title,article_text,summary,article_date,source
"Medico Legal Officer, inihayag ang opinyon sa sinasabing kalansay ni Jovelyn Galleno","Para sa Medico Legal Officer na si Dr. Eunice Herrera, tila hindi nagtutugma ang estado ng natagpuang kalansay sa araw ng pagkawala ni Jovelyn Galleno sakali mang pinaslang ito noong nawala. Dapat daw ay nasa state of decomposition pa lamang ang katawan o nasa estado palang ng pagka-agnas dahil 18 araw pa lang ang nakakalipas. Read also Ptr. Darlyn Galve, humiling ng panalangin para sa pamilya ni Jovelyn Galleno Bagamat kinokunsidera nito ang init at ulan subalit dapat ay nasa decomposition period pa lamang umano ang dalawang linggong katawan ng isang bangkay. Tanong pa ng doktora ay bakit puro ID ang nakita at nasaan ang mga damit ng biktima na sinasabing si Jovelyn. Si Jovelyn Galleno ay ang 22-anyos na nagtatrabaho sa isang mall sa Palawan. Nawala siya noong ika-5 ng Agosto kamakailan lang. Ayon sa kanyang kapatid, sinabi ng kanyang employer na 6:30 ng hapon ay nag-out na ito sa kanyang trabaho. Nag-chat pa umano ito sa kanyang kapatid ngunit hindi na ito nakauwi.   Iginiit ng pinsang buo ni Jovelyn na hindi niya ginalaw ang kanyang pinsan  ngunit naging kasabwat siya sa pagdukot sa dalaga. Ikinuwento niya kung paano nila inabangan si Jovelyn nang bumaba umano ito sa sinakyang multicab. Idinitalye niya ang umano'y ginawa ng kasamahan niya sa kanyang pinsan matapos nila itong dalhin sa lugar kung saan ito pinagsamantalahan. Matatandaang si Leobert Dasmariñas ang nagturo sa PNP kung saang lugar nila inabandona ang bangkay ni Jovelyn. Read also Pinsan ni Jovelyn, sinabing lookout lang siya sa krimen at ang isang pinsan ang nanghalay Humiling ng dasal si Ptr. Darlyn Galve, ang pastora sa simbahan ng pamilya Galleno kasunod ng mga lumabas na balitang  may natagpuang kalansay at kalakip niyon ay ang mga kagamitan ng dalaga. Makikita sa pictures na binahagi ni Ptr. Darlyn ang pagiging emosyonal ng pamilya ni Jovelyn. Umaasa pa rin sila na hindi si Jovelyn ang kalansay na narecover ng pulis matapos magsalita ng tinuturong suspek.","Binahagi ng Medico Legal Officer ng City Health Department na si Dr. Eunice Herrera, tila nakakapagduda ang iniuugnay na kalansay sa nawalang dalaga na si Jovelyn Galleno. Aniya,walang ganung kabilis na sa loob ng dalawang linggo ay magiging kalansay na lamang kaagad ang labi ng isang pumanaw kung pagbabasehan kung kailan nawala si Jovelyn. Dapat daw ay nasa state of decomposition pa lamang ang katawan o nasa estado palang ng pagka-agnas dahil 18 araw pa lang ang nakakalipas. Matatandaang narekober ang kalansay matapos ituro ng sumukong pinsan ni Jovelyn ang lugar kung saan umano naroroon ang labi ng dalaga","Tuesday, August 23, 2022 at 3:11 PM",https://kami.com.ph/tagalog/146006-medico-legal-officer-inihayag-ang-opinyon-sa-sinasabing-kalansay-ni-jovelyn-galleno/
"Pinsang buo ni Jovelyn Galleno, umamin kaugnay sa panghahalay","Bandera News TV Philippines, Nag-iba ng salaysay ang pinsang buo ni Jovelyn Galleno na si Leobert Dasmariñas kaugnay sa panghahalay sa dalaga. Sa isang bagong panayam na inilabas ng Bandera News TV Philippines, sinabi nito na pagkatapos halayin ng pinsang si Jovert Valdestamon ay siya ang sumunod na gumalaw kay Jovelyn. Matatandaang sa nauna niyang pahayag ay sinabi niyang nagsilbi lamang siyang lookout. Gayunpaman, sa kanyang bagong salaysay ay sinabi nitong ang kanyang pinsang si Jovert ang pumalit sa pagiging lookout. Read also Mga ka-lugar nina Jovelyn, wala raw naamoy sa lugar kung saan narekober ang kalansay Samantala, patuloy pa ring hinihintay ang resulta ng mga pagsusuri kaugnay sa kaso para matukoy kung talaga bang si Jovelyn yung natagpuang kalansay. Ang 22-anyos na si Jovelyn Galleno ay isang working student na nagtatrabaho sa isang mall sa Palawan. Gumulantang sa mga tao ang kanyang pagkawala noong August 5, 2022. Ayon sa pahayag ng kanyang pamilya at maging ng kanyang manager, 6:30 nang hapos ay nakapag-out na siya sa kanyang trabaho at nakapag-chat pa ito sa kanyang kapatid ngunit hindi na ito nakauwi. Iginiit ng pinsang buo ni Jovelyn na hindi niya ginalaw ang kanyang pinsan ngunit naging kasabwat siya sa pagdukot sa dalaga.  Ikinuwento niya kung paano nila inabangan si Jovelyn nang bumaba umano ito sa sinakyang multicab. Idinitalye niya ang umano'y ginawa ng kasamahan niya sa kanyang pinsan matapos nila itong dalhin sa lugar kung saan ito pinagsamantalahan. Matatandaang si Leobert Dasmariñas ang nagturo sa PNP kung saang lugar nila inabandona ang bangkay ni Jovelyn. Read also Jay Costura, nagulat sa update ng kaso ni Jovelyn ""Lahat tayo ay umaasang buhay si Jovelyn"" Humiling ng dasal si Ptr. Darlyn Galve, ang pastora sa simbahan ng pamilya Galleno kasunod ng mga lumabas na balitang may natagpuang kalansay  at kalakip niyon ay ang mga kagamitan ng dalaga. Makikita sa pictures na binahagi ni Ptr. Darlyn ang pagiging emosyonal ng pamilya ni Jovelyn. Umaasa pa rin sila na hindi si Jovelyn ang kalansay na narecover ng pulis matapos magsalita ng tinuturong suspek.","Umamin sa isang panibagong salaysay ang pinsang buo ni Jovelyn Galleno kaugnay sa panghahalay sa dalaga. Matatandaang sa kanyang naunang sinabi, lookout lamang umano siya at hindi niya ginalaw ang kanyang pinsan. Gayunpaman sa isang bagong panayam na inilabas ng . Aniya, pagkatapos halayin ng pinsang si Jovert Valdestamon ay siya ang sumunod ngunit aniya ay hindi na gumagalaw ang dalaga","Wednesday, August 24, 2022 at 10:35 AM",https://kami.com.ph/tagalog/146024-pinsang-buo-ni-jovelyn-galleno-umamin-kaugnay-sa-panghahalay/
"Jay Costura, nagulat sa update ng kaso ni Jovelyn ""Lahat tayo ay umaasang buhay si Jovelyn""","Naglabas ng pahayag si Jay Costura ilang oras matapos na lumutang ang isa sa 2 suspek ng umano'y pag biglaang pagkawala ni Jovelyn Galleno. Nalaman ng   na marami umanong nag-tag kay Jay ukol sa kaso kaya naman kanya itong pinaunlakan upang makatulong. ""Nagulat kami sa balita na natagpuan na siya na patay pero kalansay na.  Binalikan ko yung sinabi ng baraha, 'yung sinabi ng tarot na may panlilinlang, may pag-uusap may akasunduan,""  bungad ni Jay. Read also Mga ka-lugar nina Jovelyn, wala raw naamoy sa lugar kung saan narekober ang kalansay Nabanggit ni Jay na bukas ang kanyang pinto para magsagawa ng pagbabasa ng kanyang mga baraha subalit hiling niyang makasama ang pamilya o kahit isang miyembro ng kaanak ng biktima. ""Bakit gugustuhin ko na kapamilya o kadugo para maiwasan natin 'yung... Hindi natin mapi-please ang lahat ng tao na maniwala sa mga ganitong bagay. kasi mahirap naman talaga kung hindi mo nai-experience,""  ani Jay ""Willing po akong tumulong sa paraang alam ko,""  dagdag pa niya. Narito ang kabuuan ng pahayag ni Jay mula sa kanyang YouTube channel: Si Jay Costura ay isa sa mga kilalang Pinoy Psychic sa bansa. Isa siya sa mga sumubok na tumulong upang mas mapadali ang paghahanap sa  nawawalang dalaga sa Palawan  na si J ovelyn Galleno. Sa salaysay ng kapatid nito, 6:30 ng gabi nang Agosto 5, nag-out si Jovelyn na kinumpirma ng kanyang boss sa mall kung saan siya nagtatrabaho. Nakapag-chat pa umano ito sa kanyang kapatid subalit makalipas ang ilang oras, hindi pa rin ito dumarating sa kanilang bahay. Read also Kapatid ni Jovelyn, nakapanayam ng RTIA: ""Nakapagtatakang may mga buto na doon"" Sa tulong ng ilang kuha niya sa CCTV, nakumpirma nila ang ilan sa mga pinatunguhan ni Jovelyn maging ang pagsakay nito sa pampasaherong multicab.","Naglabas ng saloobin si Jay Costura kaugnay sa pag-usad ng kaso ni Jovelyn Galleno. Ito ay matapos ang rebelasyon ng suspek na siyang nakapagturo 'di umano sa kinaroroonan ng bangkay at mga gamit ng biktima. Matatandaang minsan na rin niyang binasahan ang pagkawala ni Jovelyn kung saan nabanggit niyang buhay pa umano ito. Gayunpaman, may ilang mga tao ang may agam-agam sa naturang rebelasyon lalo na at buto na lamang at kalansay ang kanilang natagpuan","Tuesday, August 23, 2022 at 11:36 PM",https://kami.com.ph/tagalog/146015-jay-costura-nagulat-ng-update-ng-kaso-ni-jovelyn-lahat-tayo-ay-umaasang-buhay-si-jovelyn/
"Mga ka-lugar nina Jovelyn, wala raw naamoy sa lugar kung saan narekober ang kalansay","Marami ang nagimbal sa pagkakatuklas ng bungo at kalansay sa mismong lugar ng nawawalang si Jovelyn Galleno. Ayon sa Pastora ng simbahan nina Jovelyn maging sila sa Pulang Lupa ay hindi naniniwalang si Jovelyn umano iyon dahil wala man lang silang naamoy sa lugar kung saan natagpuan ang bungo at kalansay. Read also Jay Costura, nagulat sa update ng kaso ni Jovelyn ""Lahat tayo ay umaasang buhay si Jovelyn"" Maging sa pakikipag-usap ni Konsehal Elgin Damasco, wala din umanong nakakita o nakaamoy man lang sa kalansay. Ayon sa isang nakatira malapit sa lugar, mukhang matagal na umano ang narekober na kalansay. Si Jovelyn Galleno ay ang 22-anyos na nagtatrabaho sa isang mall sa Palawan. Nawala siya noong ika-5 ng Agosto kamakailan lang. Ayon sa kanyang kapatid, sinabi ng kanyang employer na 6:30 ng hapon ay nag-out na ito sa kanyang trabaho. Nag-chat pa umano ito sa kanyang kapatid ngunit hindi na ito nakauwi. Iginiit ng pinsang buo ni Jovelyn na hindi niya ginalaw ang kanyang pinsan ngunit naging kasabwat siya sa pagdukot sa dalaga . Ikinuwento niya kung paano nila inabangan si Jovelyn nang bumaba umano ito sa sinakyang multicab. Idinitalye niya ang umano'y ginawa ng kasamahan niya sa kanyang pinsan matapos nila itong dalhin sa lugar kung saan ito pinagsamantalahan. Matatandaang si Leobert Dasmariñas ang nagturo sa PNP kung saang lugar nila inabandona ang bangkay ni Jovelyn. Read also Medico Legal Officer, inihayag ang opinyon sa sinasabing kalansay ni Jovelyn Galleno Humiling ng dasal si Ptr. Darlyn Galve, ang pastora sa simbahan ng pamilya Galleno kasunod ng mga lumabas na balitang  may natagpuang kalansay at kalakip niyon ay ang mga kagamitan ng dalaga. Makikita sa pictures na binahagi ni Ptr. Darlyn ang pagiging emosyonal ng pamilya ni Jovelyn. Umaasa pa rin sila na hindi si Jovelyn ang kalansay na narecover ng pulis matapos magsalita ng tinuturong suspek.","Mismong mga kalugar ng Pamilyang Galleno ang nagsabing wala man lang silang naamoy sa lugar kung saan natagpuan ang bungo at kalansay. Ito ay sinasabing labi umano ng nawawalang dalaga na si Jovelyn Galleno na narekober matapos magsalita ng nagpakilalang mga suspek. Ayon sa Pastora ng simbahan nina Jovelyn maging sila sa Pulang Lupa ay hindi naniniwalang si Jovelyn umano iyon. Gayunpaman, hihintayin umano nila ang magiging resulta ng siasagawang pagsusuri at DNA testing para tuluyang matukoy ang pagkakakilanlan ng kalansay","Tuesday, August 23, 2022 at 11:51 PM",https://kami.com.ph/tagalog/146019-mga-ka-lugar-nina-jovelyn-wala-raw-naamoy-sa-lugar-kung-saan-narekober-ang-kalansay/
"Viral teacher na umano'y nagmura, haharap sa admin proceedings ayon sa DepEd","Nagsalita na ang Department of Education kaugnay sa naganap na pagmumura 'di umano ng isang teacher sa kanyang Grade 5 student sa unang araw pa lamang ng klase noong Agosto 22. Nalaman ng   na nakarating na sa DepEd ang naturang sitwasyon matapos na mag-viral ang post ng nagpakilalang tiya ng estudyante na si Jeannie Vargas. Read also 52-anyos na Grab driver sa gabi, Grade 12 student naman sa umaga Sa kanyang post, makikita ang kapiraso ng papel kung saan nakasulat ang 'di umano'y nasabing masasakit na salita ng kanyang teacher dahilan para umuwi ito na iyak ng iyak. Samantala, sa ulat ng  Inquirer , sinabing hindi ito isinantabi ng DepEd. ""The teacher will be subjected to administrative proceedings in accordance with our rules. The DepEd takes these incidents very seriously,""  ayon kay DepEd spokesman Michael Poa. Sasailalim naman sa Psychological first aid ang estudyante at patuloy na imo-monitor ang kalagayan dagdag pa ni Poa. Read also Mga ka-lugar nina Jovelyn, wala raw naamoy sa lugar kung saan narekober ang kalansay Narito ang kabuuan ng post: Nito lamang Lunes, Agosto 22 nang magbukas muli ang mga paaralan sa kauna-unahang nationwide  in-person classes  sa mga pampublikong paaralan makalipas ang dalawang taon. Matatandaang ilang mga eskwelahan na nasa ilalim ng alert level 1 ang  nagsimula nang magbalik paaralan  sa pagtatapos ng panuruang taon 2021-2022. At dahil sa naging matagumpay ang pagsasagawa nito, pinahintulutan nang magbalik paaralan muli ang mga estudyante mula Kinder hanggang kolehiyo.","Mahaharap sa administrative proceedings ang nag-viral na teacher na umano'y nakapagsalita agad ng 'di maganda sa kanyang mag-aaral. Ayon sa Department of Education, hindi nila ito isasawalang bahala lalo na at isa itong seryosong usapin. Matatandaang ang tiya ng estudyante ang siyang nag-post na 'di umano'y nasabi ng teacher sa kanyang pamangkin na umuwing umiiyak. Sa tindi ng takot, isinulat na lamang ng bata ang umano'y nasabi ng teacher na labis nilang ikinagulat at ikinasama ng loob","Wednesday, August 24, 2022 at 2:19 PM",https://kami.com.ph/tagalog/146028-deped-admin-proceedings-teacher-verbal-abuse-grade-5-student/
"52-anyos na Grab driver sa gabi, Grade 12 student naman sa umaga","Marami ang bumilib sa 52-anyos na Grab driver na si Benjie Estillore na isa ring Grade 12 student sa umaga. Nalaman ng  na umantig sa puso ng marami ang larawang kuha ni Earl Licera kung saan makikita si Benjie na nakasuot ng uniporme at siya pang may hawak ng kanilang Grade and section sa unang araw ng klase noong Agosto 22. Read also Jay Costura, nagulat sa update ng kaso ni Jovelyn ""Lahat tayo ay umaasang buhay si Jovelyn"" Ayon sa ulat ng  News 5 , pangarap umano ni Benjie ang makatapos sa pag-aaral kaya ganoon na lamang ang kanyang determinasyon na pumasok sa eskwelahan sa kabila ng kanyang edad. At sa gabi, saka naman siya naghahanapbuhay bilang isang Grab driver.    Narito ang ilan sa mga positibo at nakatataba ng pusong komento ng netizens: Matatandaang kamakailan, muling  nag-viral din ang isang delivery rider  dahil nakatapos na siya ng kolehiyo at with latin honors pa. Read also Medico Legal Officer, inihayag ang opinyon sa sinasabing kalansay ni Jovelyn Galleno Noong 2020, nag-viral na si Francis Jan Ax Valerio dahil sa larawang kuha sa kanya kung saan nagagawa niyang dumalo ng kanyang online classes  sa kabila ng kanyang pagtatrabaho . Tulad ni Tatay Benjie, inspirasyon ang hatid ni Francis na dahil sa pagpapahalaga sa edukasyon, kinaya nila ang anumang balakid o maaring maging hadlang makamit lamang ang inaasam-asam na Katibayan ng Pagtatapos sa paaralan.","Hinangaan ng marami ang isang Grab driver na pumapasok pa rin sa paaralan at nasa Grade 12 na. Nag-viral ang larawan kung saan makikitang hawak pa ng Grab driver ang karatula ng kanilang Grade and section sa unang araw ng klase. Mahalaga umano ang edukasyon kaya naman sa kabila ng kanyang edad, pumasok pa rin siya sa paaralan. Umani naman ng iba't ibang positibong reaksyon ang larawan na nagsilbing inspirasyon sa marami","Wednesday, August 24, 2022 at 1:25 PM",https://kami.com.ph/tagalog/146027-52-anyos-na-grab-driver-sa-gabi-grade-12-student-naman-sa-umaga/
"Dr. Raquel Fortun sa nakitang kalansay na hinihinalang si Jovelyn Galleno: ""Possible yan""","Super Radyo, b Ayon sa respetadong forensic pathologist sa bansa na si Dr. Raquel Barros del Rosario-Fortun, may posibilidad umano na maging buto kaagad o kalansay ang katawan ng tao sa loob lamang ng labing walong araw. Sa panayam ng  Super Radyo  kay Dr. Fortun, binahagi niya rin ang kanyang opinyon kaugnay sa isinagawang proseso sa pagrekober sa natagpuang kalansay. Read also Ina ni Jovelyn Galleno, malakas umano ang kutob na buhay pa ang kanyang anak Ito ay kung isaalang-alang ang ilang mga salik kagaya ng ulan at init ng panahon maging ang kinalagyan o lugar kung saan natagpuan ang kalansay. Ikinokonsidera rin nito na nasa ibabaw ng lupa ang kalansay na posible ring kinain o ikalat ng mga aso o hayop.    Ang 22-anyos na si Jovelyn Galleno ay isang working student na nagtatrabaho sa isang mall sa Palawan. Gumulantang sa mga tao ang kanyang pagkawala noong August 5, 2022. Ayon sa pahayag ng kanyang pamilya at maging ng kanyang manager, 6:30 p.m. ay nakapag-out na siya sa kanyang trabaho at nakapag-chat pa ito sa kanyang kapatid ngunit hindi na ito nakauwi. Read also 52-anyos na Grab driver sa gabi, Grade 12 student naman sa umaga Iginiit ng pinsang buo ni Jovelyn na hindi niya ginalaw ang kanyang pinsan ngunit naging kasabwat siya sa pagdukot sa dalaga.  Ikinuwento niya kung paano nila inabangan si Jovelyn nang bumaba umano ito sa sinakyang multicab. Idinitalye niya ang umano'y ginawa ng kasamahan niya sa kanyang pinsan matapos nila itong dalhin sa lugar kung saan ito pinagsamantalahan. Matatandaang si Leobert Dasmariñas ang nagturo sa PNP kung saang lugar nila inabandona ang bangkay ni Jovelyn. Nang sumunod na araw ay umamin ang pinsang buo ni Jovelyn kaugnay sa panghahalay sa dalaga.  Matatandaang sa kanyang naunang sinabi, lookout lamang umano siya at hindi niya ginalaw ang kanyang pinsan. Gayunpaman sa isang bagong panayam na inilabas ng Bandera News TV Philippines, nag-iba ito ng pahayag. Aniya, pagkatapos halayin ng pinsang si Jovert Valdestamon ay siya ang sumunod ngunit aniya ay hindi na gumagalaw ang dalaga.","Nagbigay ng kanyang pananaw ang forensic pathologist na si Dr. Raquel Barros del Rosario-Fortun kaugnay sa natagpuang kalansay na pinaniniwalaang si Jovelyn Galleno. Aniya, posible umanong maging kalansay ang kalatawan ng isang taong pumanaw sa loob ng 18 araw. Ito ay kung isaalang-alang ang ilang mga elemento kagaya ng ulan at init ng panahon maging ang kinalagyan o lugar kung saan natagpuan ang kalansay. Sa panayam ng","Wednesday, August 24, 2022 at 11:57 PM",https://kami.com.ph/tagalog/146045-dr-raquel-fortun-sa-nakitang-kalansay-na-hinihinalang-si-jovelyn-galleno-yan/
"Ina ni Jovelyn Galleno, malakas umano ang kutob na buhay pa ang kanyang anak","103.1 Brigada News FM - Palawan  Emosyonal si Jelyn Galleno, ina ni Jovelyn Galleno nang magbigay ito ng mensahe para sa anak. Sa isang panayam na binahagi ng  103.1 Brigada News FM - Palawan,  sinubukan niyang palakasin ang loob ng anak at sinabihang huwag mawalan ng pag-asa at manalangin. Read also Pinsang buo ni Jovelyn Galleno, umamin kaugnay sa panghahalay Aniya, marami ang nagdadasal para sa kanilang pamilya at naniniwala siyang malalampasan din nila ang pinagdadaanang pagsubok. Hindi umano sila nagpapabaya sa paghahanap kay Jovelyn. Ang 22-anyos na si Jovelyn Galleno ay isang working student na nagtatrabaho sa isang mall sa Palawan. Gumulantang sa mga tao ang kanyang pagkawala noong August 5, 2022. Ayon sa pahayag ng kanyang pamilya at maging ng kanyang manager, 6:30 p.m. ay nakapag-out na siya sa kanyang trabaho at nakapag-chat pa ito sa kanyang kapatid ngunit hindi na ito nakauwi. Iginiit ng pinsang buo ni Jovelyn na hindi niya ginalaw ang kanyang pinsan ngunit naging kasabwat siya sa pagdukot sa dalaga.  Ikinuwento niya kung paano nila inabangan si Jovelyn nang bumaba umano ito sa sinakyang multicab. Idinitalye niya ang umano'y ginawa ng kasamahan niya sa kanyang pinsan matapos nila itong dalhin sa lugar kung saan ito pinagsamantalahan. Matatandaang si Leobert Dasmariñas ang nagturo sa PNP kung saang lugar nila inabandona ang bangkay ni Jovelyn. Nang sumunod na araw ay umamin ang pinsang buo ni Jovelyn kaugnay sa panghahalay sa dalaga.  Matatandaang sa kanyang naunang sinabi, lookout lamang umano siya at hindi niya ginalaw ang kanyang pinsan. Gayunpaman sa isang bagong panayam na inilabas ng Bandera News TV Philippines, nag-iba ito ng pahayag. Aniya, pagkatapos halayin ng pinsang si Jovert Valdestamon ay siya ang sumunod ngunit aniya ay hindi na gumagalaw ang dalaga.","Hindi napigilan ng ina ni Jovelyn Galleno na maging emosyonal habang nagbibigay ng mensahe para sa anak. Malakas umano ang kutob niyang buhay pa ang anak niya at ay may humahawak lang sa kanyang anak. Sa video na binahagi ng . Aniya, isa lang malaking pagsubok para sa kanilang pamilya ang pangyayari at aniya ay malalampasan din nila iyon sa tulong ng mga taong nanalangin para sa ligtas na pagbabalik ng dalaga","Wednesday, August 24, 2022 at 11:42 PM",https://kami.com.ph/tagalog/146044-ina-ni-jovelyn-galleno-alakas-umano-ang-kanyang-kutob-na-buhay-pa-humahawak-lang-sa-kanyang-anak/
"Alahas ni Jovelyn Galleno, nahukay malapit sa bahay ng suspek","Itinuro ng suspek at pinsang buo ni Jovelyn Galleno na si Leobert Dasmariñas ang lugar kung saan umano niya inilibing ang kwintas at bracelet ni Jovelyn. Ayon sa ina ni Jovelyn, ang mga alahas na ito ay ang kanyang regalo sa anak noong bata pa ito. Kasama ang mga otoridad, tumungo ang suspek na si Leobert Dasmariñas sa Purok Pulang Lupa, Barangay Sta. Lourdes kung saan itinuro niya sa tabi ng punong saging inilibing ang hinahanap na alahas ni Jovelyn. Ito ay nasa bakuran lamang malapit sa kanilang bahay. Read also Jovert Valdestamon, handa raw patunayang hindi totoo ang alegasyon sa kanya Base sa isang post ng  Radyo Bandera Philippines,  ang naturang business establishment ay matatagpuan sa Brgy. Tagburos. Wala pang opisyal na pahayag ang PNP kaugnay dito at wala pa ring kumpirmasyon mula sa pamilya ni Jovelyn kung siya ba ang nahagip sa CCTV footage na nakasakay sa multicab.   Nauna nang naiulat ng  Palawan Star  na taliwas sa naunang impormasyon na Sedan ang sinakyan ni Jovelyn, multicab umano ang sinakyan nito base na rin sa isang CCTV footage. Ang 22-anyos na si Jovelyn Galleno ay isang working student na nagtatrabaho sa isang mall sa Palawan. Gumulantang sa mga tao ang kanyang pagkawala noong August 5, 2022. Ayon sa pahayag ng kanyang pamilya at maging ng kanyang manager, 6:30 p.m. ay nakapag-out na siya sa kanyang trabaho at nakapag-chat pa ito sa kanyang kapatid ngunit hindi na ito nakauwi. Read also Jonalyn Galleno, sinabing umamin sa kanya ang pinsan na hindi kay Jovelyn ang kalansay Iginiit ng pinsang buo ni Jovelyn na hindi niya ginalaw ang kanyang pinsan ngunit naging kasabwat siya sa pagdukot sa dalaga.  Ikinuwento niya kung paano nila inabangan si Jovelyn nang bumaba umano ito sa sinakyang multicab. Idinitalye niya ang umano'y ginawa ng kasamahan niya sa kanyang pinsan matapos nila itong dalhin sa lugar kung saan ito pinagsamantalahan. Matatandaang si Leobert Dasmariñas ang nagturo sa PNP kung saang lugar nila inabandona ang bangkay ni Jovelyn. Nang sumunod na araw ay umamin ang pinsang buo ni Jovelyn kaugnay sa panghahalay sa dalaga.  Matatandaang sa kanyang naunang sinabi, lookout lamang umano siya at hindi niya ginalaw ang kanyang pinsan. Gayunpaman sa isang bagong panayam na inilabas ng Bandera News TV Philippines, nag-iba ito ng pahayag. Aniya, pagkatapos halayin ng pinsan si Jovert Valdestamon ay siya ang sumunod ngunit aniya ay hindi na gumagalaw ang dalaga.","Kasama ang mga otoridad, tumungo ang suspek na si Leobert Dasmariñas sa Purok Pulang Lupa, Barangay Sta. Lourdes. Dito ay itinuro ni Leobert sa tabi ng punong saging inilibing ang hinahanap na alahas ni Jovelyn Galleno. Kinumpirma ng pamilyang Galleno na ang alahas ay kay Jovelyn ayon kay kagawad Angelito Reyes ng Sta. Lourdes. Ayon sa ina ni Jovelyn, ang mga alahas na ito ay ang kanyang regalo sa anak noong bata pa ito","Thursday, August 25, 2022 at 11:59 PM",https://kami.com.ph/tagalog/146071-alahas-ni-jovelyn-galleno-nahukay-malapit-sa-bahay-ng-suspek/
"Jonalyn Galleno, sinabing umamin sa kanya ang pinsan na hindi kay Jovelyn ang kalansay","Ayon kay Jonalyn Galleno, kapatid ni Jovelyn Galleno, hindi pa rin kumbinsido ang pamilya nila tungkol sa kalansay na natagpuan. Sa pakikipag-usap ni Jonalyn Galleno kay Senator Raffy Tulfo, sinabi nito na naguguluhan siya sa nagiging kilos ng kanilang pinsan na umamin tungkol sa krimen. Ipinagtataka nila na kaya sumuko si Leobert Dasmariñas ay dahil sa pagkakasaksak niya sa kanyang pinsan. Matapos ang dalawang araw ay bigla umano itong umamin tungkol sa krimen. Tila umano tulala si Leobert at nakatingin sa pulis. Read also Cristy Fermin, todo puri kay Alden Richards sa pagpapahalaga nito sa pamilya Ang 22-anyos na si Jovelyn Galleno ay isang working student na nagtatrabaho sa isang mall sa Palawan. Gumulantang sa mga tao ang kanyang pagkawala noong August 5, 2022. Ayon sa pahayag ng kanyang pamilya at maging ng kanyang manager, 6:30 p.m. ay nakapag-out na siya sa kanyang trabaho at nakapag-chat pa ito sa kanyang kapatid ngunit hindi na ito nakauwi.   Iginiit ng pinsang buo ni Jovelyn na hindi niya ginalaw ang kanyang pinsan ngunit naging kasabwat siya sa pagdukot sa dalaga . Ikinuwento niya kung paano nila inabangan si Jovelyn nang bumaba umano ito sa sinakyang multicab. Idinitalye niya ang umano'y ginawa ng kasamahan niya sa kanyang pinsan matapos nila itong dalhin sa lugar kung saan ito pinagsamantalahan. Matatandaang si Leobert Dasmariñas ang nagturo sa PNP kung saang lugar nila inabandona ang bangkay ni Jovelyn. Nang sumunod na araw ay umamin ang pinsang buo ni Jovelyn kaugnay sa panghahalay sa dalaga . Matatandaang sa kanyang naunang sinabi, lookout lamang umano siya at hindi niya ginalaw ang kanyang pinsan. Gayunpaman sa isang bagong panayam na inilabas ng Bandera News TV Philippines, nag-iba ito ng pahayag. Aniya, pagkatapos halayin ng pinsan si Jovert Valdestamon ay siya ang sumunod ngunit aniya ay hindi na gumagalaw ang dalaga.","Hindi pa rin kumbinsido ang pamilya ni Jovelyn Galleno na sa kanya ang natagpuang kalansay. Sa pakikipag-usap ni Jonalyn Galleno kay Senator Raffy Tulfo, sinabi nito na naguguluhan siya sa nagiging kilos ng kanilang pinsan na umamin tungkol sa krimen. Ayon kay Jonalyn, dalawang beses niyang tinanong ang pinsan kung sa ate niya ang kalansay at ang sagot umano nito ay ""hindi"". Hinihintay pa rin ang magiging resulta ng sinagawang DNA testing upang matukoy kung si Jovelyn nga iyon","Friday, August 26, 2022 at 10:33 PM",https://kami.com.ph/tagalog/146095-leobert-dasmari-umamin-umano-kay-jonalyn-na-hindi-kay-jovelyn-ang-kalansay/
