title,article_text,summary,article_date,source
"Kamag-anak ng 26 sa nasawi sa landslide, hiling na makita ang iba pang nawawalang kamag-anak","26 sa kanyang mga kaanak ni Mantessa Polvera ang inabutan niyang wala nang buhay sa Sitio Waterfalls, Barangay Mailhi sa Baybay City. May mga kamag-anak pa umano silang hindi pa nakikita kaya hiling niya na mahanap at makita nila ang iba pang kamag-anak upang kahit papaano ay mailibing pa rin sila. Read also Bangkero sa Surigao, naiyak matapos makatanggap ng biyaya mula kay Madam Kilay Umuwi si Polvera sa Leyte mula sa Maynila nang malaman ang nangyari. Kabilang ang mga kamag-anak niya sa mga nasawi sa landslide matapos ang pag-ulan bunsod ng bagyong Agaton. Apat pa ang hindi nahahanap sa 26 na kamag-anak niyang nasawi.  ""Kahit patay na sila makita man lang sila at mailibing man lang sila nang maayos. Kahit ’yun lang naman po ’yung maibigay namin,"" ani Polvera sa mga awtoridad.  Enjoyed reading our story?  Download  KAMI's news app on Google Play now and stay up-to-date with major Filipino news! Hindi naging madali ang  search and retrieval operations dahil sa lalim at lambot ng putik dulot ng paminsan-minsang pagbuhos ng ulan, bagay na maaaring maglagay sa alanganin ng buhay ng mga naghahanap sa mga biktima. Sa Barangay Mailhi at Kantagnos na lang ang patuloy ang search and retrieval operations, habang itinigil na ang paghahanap ng mga bangkay sa ibang mga barangay. Read also Zeinab Harake, naka-unfollow na sa Instagram account ni Skusta Clee Sa pagpasok ng pandemya, lalong naging aktibo ang mga Pinoy sa social media. Bukod sa mga lockdown at quarantine restrictions, lalong naging aktibo sa internet at social media ang mga tao. Kaya naman, mas mabilis na rin ang paglaganap ng mga balita. Kadalasan ay nagiging viral ang mga balitang pumupukaw sa interes ng karamihan. Matatandaang ilan sa mga pinakatinutukang kaso ng  pagpaslang ay ang pagbaril ng pulis na si Jonel Nuezca sa mag-ina.  Kinalaunan ay nahatulan ito at nakulong hanggang sa kamakailan ay lumabas ang balitang pumanaw na ito. Pumukaw din sa interes ng publiko ang sinapit ng isang  Grab driver na si Jang Lucero.  Naging mailap ang pagkuha ng hustisya para kay Lucero matapos ang mahigit isang taon.","Ipinagluluksa ni Mantessa Polvera ang pagkasawi ng kanyang kaanak sa naganap na landslide sa  Sitio Waterfalls, Barangay Mailhi sa Baybay City. 26 sa kanyang mga kaanak ang nasawi sa landslide matapos ang pag-ulan bunsod ng bagyong Agaton. Nananawagan siya na sana ay huwag tigilan ang search and retrieval operations para mahanap ang iba pang biktima ng landslide. Aniya, hiling niya na mahanap at makita nila ang iba pang kamag-anak upang kahit papaano ay mailibing pa rin sila","Sunday, April 17, 2022 at 11:49 PM",https://kami.com.ph/tagalog/141742-nagluluksang-kamag-anak-ng-26-sa-nasawi-sa-landslide-sa-leyte-hiling-na-mamakita-ang-iba-pang-kamag-anak/
"Herbert Bautista, humingi ng dispensa kaugnay sa kanyang viral video","Sa isang panayam sa SMNI News, nabanggit ni Herbert Bautisa na nakita umano niya ang paa ng taong pumatid sa kanya kaya siya nagalit. Gayunpaman, inihingi niya ng dispensa ang kanyang pinakitang ugali dahil nadala lamang umano siya ng kanyang emosyon. Kwento ni Bautista, hindi umano sila kaagad pinapasok dahil wala umano silang tag. Nung makita umano at nakilala siya, pinapapasok na siya ngunit hinintay nila ang organizer para mabigyan ng tag ang kanyang mga kasamahan.  Read also Kamag-anak ng 26 sa nasawi sa landslide, hiling na makita ang iba pang nawawalang kamag-anak Noong papasok na sila, nadapa umano siya at nakita daw niya ang paa ng nagbabantay. Ito ang naging dahilan ng kanyang pagkagalit na humantong sa pang-aawat sa kanya para maiwasan ang gulo. Kinalaunan naman ay nagkausap umano sila at nagkaayos naman din sila umano ng taong aniya ay pumatid sa kanya.  Enjoyed reading our story?  Download  KAMI's news app on Google Play now and stay up-to-date with major Filipino news! Matatandaang nag-viral kamakailan ang video niya kung saan nagalit siya matapos umano siyang patirin. Makikita sa viral video kung paanong nagalit ang dating Quezon city mayor. Naganap ito sa isang political rally para kay presidential aspirant Bong Bong Marcos. Isa lamang si Bautista sa mga tumatakbo para sa pagiging senador ngayong halalan 2022. Si Herbert Bautista o kilala sa bansag na ""Bistek,"" ay isang Filipino actor na naging politiko na nanungkulan bilang mayor ng Quezon City. Nagsimula siya sa pag-arte sa murang edad na 10. Naging bahagi siya ng gag show na  Kaluskos Musmos  na ipinalabas mula 1970 hanggang kalagitnaan ng 1980s. Read also Kampo ni Andrea Brillantes, umalma sa mga fake news na nilalabas ng bashers Siya ang gumanap bilang Reneboy sa seryeng  Flordeluna  noong 1978-1984 na pinalabas sa RPN-9. Matatandaang sa isang rally kamakailan ay  sinabihan ni Herbert ang kanyang di na pinangalanang ex na magpagaling. Naging usap-usapan din ang paghahayag ni Ruffa Gutierrez ng  kanyang pagsuporta sa kandidatura ni Herbert.","Sa isang panayam ng SMNI News, nilinaw ni dating Quezon City Mayor Herbert Bautista ang kaugnay sa kanyang viral na video. Aniya, nakita niya ang paa ng taong umano ay pumatid sa kanya kaya siya agad na nagalit. Gayunpaman, inihingi niya ng dispensa ang kanyang pinakitang ugali dahil nadala lamang umano siya ng kanyang emosyon. Matatandaang nag-viral kamakailan ang video niya kung saan nagalit siya matapos umano siyang patirin","Monday, April 18, 2022 at 2:08 AM",https://kami.com.ph/tagalog/141803-herbert-bautista-humingi-ng-dispensa-kaugnay-sa-kanyang-viral-video/
"Groom sa Marinduque, nasawi habang patungo sa reception ng kanilang kasal","Nauwi sa mapait na aksidente ang masaya sanang pagtitipon gayung nasawi ang groom patungo sa kanilang wedding reception. Nalaman ng  na nasawi ang 26-anyos na groom na si Alan Roldan mula Torrijos, Marinduque at dalawa pang sakay ng jeep na 'di umano'y nawalan ng preno at nahulog sa bangin. Sa ulat ng  GMA Regional TV News , nasawi rin ang isang batang babae habang ang 28 na lulan pa ng jeep ay pawang sugatan din. Read also VP Leni sa isang restaurant matapos ang 2nd presidential debate, viral Sa inisyal na imbestigasyon, naganap ang pag-iisang dibdib nina Alan sa Sta Cruz, subalit ang selebrasyon at wedding reception naman ay sa Barangay Buangan.  Enjoyed reading our story?  Download  KAMI's news app on Google Play now and stay up-to-date with major Filipino news! Nasa kustodiya naman ng pulisya ang driver ng jeep at inaasahang haharap sa patong-patong na reklamo. Samantala, walang naibigay nang pahayag kung ano ang kalagayan ng bride na labis na naghihinagpis sa sana'y masayang araw nila ng kanyang mister. Narito ang kabuuan ng ulat: Sa kabila ng pandemya at patuloy na paglaganap ng COVID-19, marami ang hindi papigil at itinutuloy pa rin ang pag-iisang dibdib lalo na at karamihang bahagi ng bansa ay pawang nasa alert level 1 na lamang. Kamakailan, agaw-eksena rin sa social media ang video ng isang pari na siyang nagkasal mismo sa kanya raw ex-girlfriend. Nakatutuwang inamin niya ito sa kasal na nilarawan niyang doon lamang siya pinagpawisan nang husto. Read also VP Leni sa mga 'fake news' : ""Magsisinungaling may maisulat lang"" Kinagiliwan at hinangaan din ng marami ang  isang kasalan na Php3,000 lang ang nagastos  ng bride at groom sa kanilang wedding reception na ginanap sa Mang Inasal. Gayundin ang isang bride na ayaw ng enggrandeng kasalan kaya naman niregaluhan na lamang siya ng kanyang groom ng 6000 sqm na lote. Sa panahon ng pandemya, ilan lamang sila sa mga hindi nagpatinag sa virus at  itinuloy pa rin ang kanilang pag-iisang dibdib . Siniguro lamang nila ang pagsunod sa safety protocols at tamang bilang ng mga panauhin.","Nasawi ang isang groom sa Marinduque na patungo sa kanilang wedding reception. Bukod sa groom, dalawa pa ang pumanaw sa aksidente kabilang na ang isang batang babae. 28 pa ang sugatan na pawang mga sakay din ng jeep kung saan lulan ang groom. Sinabing nawalan ng preno ang sinasakyang jeep ng groom at bisita sa kasal","Tuesday, April 05, 2022 at 10:32 PM",https://kami.com.ph/tagalog/141385-groom-sa-marinduque-nasawi-habang-patungo-sa-reception-ng-kanilang-kasal/
"ABS-CBN reporter, kinaaliwan matapos ibahagi ang natanggap na free hug","Marami ang natuwa sa bagong reporter ng ABS-CBN na si Izzy Lee. Ito ay matapos niyang ibahagi ang pictures na kuha habang naghahanda siya para sa kanyang live report. Isang palaboy ang lumapit sa kanya na kinalaunan ay yumakap sa kanya. “So this happened at work today. A free hug,” ani Lee sa kanyang tweet. Umabot sa mahigit 40,000 na beses itong ni-retweet at 329.5K na likes mula sa mga Twitter users. Read also Francine Diaz, pinag-shopping ang kanyang dalawang malapit na kaibigan Marami ang natuwa sa naging reaksiyon ng reporter kahit halatang nagulat din ito sa ginawa ng babae:  Enjoyed reading our story?  Download  KAMI's news app on Google Play now and stay up-to-date with major Filipino news! Si Izzy Lee ay isang reporter sa ABS-CBN. Base sa kanyang Twitter profile, nagtrabaho sin siya sa GMA News at  PumaPodcast.  Nito lamang April 25 ay binati siya ng kanyang kasamahan sa ABS-CBN sa pagiging bahagi nito ng ABS-CBN News. Read also Donnalyn Bartolome, ibinahagi ang isang kubo mansion tour Ang ABS-CBN o Alto Broadcasting System - Chronicle Broadcasting Network ay kilala din sa tawag na Kapamilya network. Maitututring itong isa sa pinakamalaking istasyon ng telebisyon sa bansa. Ayon sa kanilang pahayag,  11,000 ang empleyado  nito na apektado sa kasalukuyang krisis na kanilang kinakaharap. Ilan sa mga Kapamilya stars ang naglabas ng kanilang saloobin hinggil sa p agkaka-deny sa franchise renewal ng ABS-CBN.  Ilan sa mga ito ay sina John Manalo, RR Enriquez, Edward Barber at marami pang iba.","Umani ng positibong komento ang social media post ng reporter ng ABS-CBN na si Izzy Lee. Habang naghahanda siya para sa kanyang pag-ulat, isang palaboy ang lumapit sa kanya. Sa sumunod na picture ay makikita itong nakayakap na sa reporter at nakangiti png nakatingin sa camera. Marami ang natuwa sa naging reaksiyon ng reporter kahit halatang nagulat din ito sa ginawa ng babae","Thursday, April 28, 2022 at 11:31 PM",https://kami.com.ph/tagalog/142125-abs-cbn-reporter-kinaaliwan-matapos-ibahagi-ang-natanggap-na-free-hug/
"Lalaki sa viral na video sa Baguio market, pinabulaanang sinigawan si Jillian Robredo","Nilinaw ng lalaking nakuhanang sumisigaw sa viral na video sa Baguio market na hindi siya humihingi ng tawad sa nangyari dahil wala umano siyang dapat ihingi ng tawad. Umalma siya sa lumabas na balita na sinigawan niya umano ang anak ni VP Leni Robredo. Matapos ang paglabas ng mga videos sa pangyayari sa Baguio market, mismong si Mayor Benjie Magalong ay humingi ng dispensa. Read also Zeinab Harake, hindi napigilan ang emosyon sa pinakabagong vlog Sa video na nilabas ng Facebook user na  Cliff Lewis  nilinaw niyang hindi umano totoo ang lumabas na balita. Aniya, nagmamadali siya noong mga oras na iyon kaya nakiraan siya. Dipensa pa niya, hindi daw nirespeto ng mga ito ang market dahil sinasarahan ng mga ito ang mga paninda.  Enjoyed reading our story?  Download  KAMI's news app on Google Play now and stay up-to-date with major Filipino news! Wala din umanong nagturo sa kanya at wala siyang kodigo. Hindi niya daw nakaharap ang anak ni VP Leni at tanging ang supporter lang nito ang kanyang nakaharap kaya hindi totoong sinigawan niya si Jillian Robredo. Hiniling niya rin na tanggalin ang nilabas na balita dahil inedit daw ang video na nilabas sa balita. Read also Andrea Brillantes, naniniwalang makukumbinsi rin si Ricci Rivero na maging 'Kakampink' Samantala, sinabi ni Jillian sa isang tweet na tuloy pa rin ang kanilang house to house matapos ang insidente. Si Jillian Robredo ang bunsong anak ni Vice President Leni Robredo. Mayroon siyang dalawang nakatatandang kapatid na sina Aika at Patricia Robredo. Nagtapos si Jillian sa Philippine Science High School at kasalukuyang nag-aaral sa isang unibersidad sa ibang bansa at isang iskolar. Matatandaang  kinondena ng Robredo People’s Council (RPC) ang nangyari habang nangangampanya si Jillian sa Baguio market. Humingi naman ng  dispensa si Mayor Benjie Magalong kay Jillian  kaugnay sa naganap na kaguluhan.","Naglabas ng video ang lalaking sangkot sa viral na video sa Baguio market para linawin  umano ang nangyari. Aniya, hindi niya sinigawan si Jillian at ang nakaharap lamang umano niya ay ang isa sa supporter ni VP Leni. Nagmamadali umano siya noong mga oras na iyon at nahaharangan umano ang daanan. Iginiit niyang hindi tama ang lugar na iyon para sa ginawa nilang pangangampanya","Thursday, April 28, 2022 at 8:12 AM",https://kami.com.ph/tagalog/142097-lalaki-sa-viral-na-video-sa-baguio-market-umalma-sa-lumabas-na-balita/
"Netizen, umasang mahanap na ang kanyang nawawalang tiyahin","Nabuhayan ng pag-asa ang isang netizen matapos nitong makita ang viral na post ng ABS-CBN reporter na si Izzy Lee kung saan nakatnggap siya ng free hug mula sa isang babae. Agad na nag-viral ang post ng Facebook user na si  Patricia Pangilinan Malcado  lalo't marami sa mga netizens ang nakapansin sa pagkakahawig ng babae sa ibinahaging niyang mga litrato sa babaeng yumakap sa ABS-CBN reporter. Read also Toni Fowler, nagbahagi siya ng saloobin kaugnay sa ginawa ni Rob Moya Ayon pa sa naturang netizen, tinitingna niya ang mga palaboy tuwing lumuluwas siya ng Maynila dahil sa pagbabakasakaling mahanap niya ang kanyag tiyahin. Huling din iya ng tulong sa kung sino man ang nakakita sa kanyang tiyahin.  Enjoyed reading our story?  Download  KAMI's news app on Google Play now and stay up-to-date with major Filipino news! Si Izzy Lee ay isang reporter sa ABS-CBN. Base sa kanyang Twitter profile, nagtrabaho din siya sa GMA News at  PumaPodcast.  Makikita din sa kanyang social media account na nito lamang April 25 ay binati siya ng kanyang kasamahan sa ABS-CBN sa pagiging bahagi nito ng ABS-CBN News. Read also Zeinab Harake, binahagi ang mga tinamong galos sa kanyang tuhod Maitututring ang ABS-CBN na isa sa pinakamalaking TV station sa bansa bago ito nawalan ng prangkisa. Ayon sa inilabas nilang pahayag,  11,000 ang empleyado  nito ang naapektuhan sa pagkakasara ng kanilang estasyon. Ilan sa mga Kapamilya stars ang naglabas ng kanilang saloobin hinggil sa  pagkaka-deny sa franchise renewal ng ABS-CBN . Ilan sa mga ito ay sina John Manalo, RR Enriquez, Edward Barber at marami pang iba.","Matapos mag-viral kamakailan ang post ng ABS-CBN reporter na si Izzy Lee kung saan may babaeng yumakap sa kanya, isang netizen ang umaasang makita na nila ang nawawala niyang tiyahin. Ibinahagi nito ang ilan sa mga litrato ng kanyang nawawalang tita na aniya ay hinahanap na rin ng kanyang  mga kapatid. Ayon pa sa naturang netizen, tinitingna niya ang mga palaboy tuwing lumuluwas siya ng Maynila dahil sa pagbabakasakaling mahanap niya ang kanyag tiyahin. Agad na nag-viral ang kanyang post lalo't marami sa mga netizens ang nakapansin sa pagkakahawig ng babae sa ibinahaging mga litrato sa babaeng yumakap sa ABS-CBN reporter kamakailan","Saturday, April 30, 2022 at 4:33 PM",https://kami.com.ph/tagalog/142169-netizen-umasang-mahanap-na-ang-kanyang-nawawalang-tiyahin/
"5-anyos na batang nag-aaruga sa lola na bulag, umantig sa puso ng netizens","Maraming netizens ang naantig sa maiksing video ng batang si Alayza na siyang nagsisilbing mata ng kanyang Lola Eliza. Nalaman ng  na limang taong gulang lamang si Alayza subalit siya na karamihan ang gumgawa ng mga gawaing bahay. Sa video, makikitang tumutulong si Alayza sa kanyang lola na maglaba. Ang lola Eliza niya, kahit walang nakikita ay sinisikap pa rin na kusutin ang mga damit nila. Read also Chie Filomeno, umalma sa pagdawit sa kanya sa isang malisyosong video Nang sumapit na ang oras para maghanda ng pananghalian, si Alayza rin ang naglinis ng isda na kanya ring lulutuin.  Enjoyed reading our story?  Download  KAMI's news app on Google Play now and stay up-to-date with major Filipino news! ""Mahigit tatlong dekada na akong hindi nakikita. Ang nagsisilbi kong mata ngayon, ‘yung apo ko, si Alaiza,""  pahayag ni Lola Eliza sa Kapuso Mo, Jessica Soho (KMJS) Samantala, si Alayza, sa kabila ng kanyang murang edad ay tila nauunawaan na ang responsibilidad na nakaatang sa kanya. ""Bulag po si Lola. Walang mag-aasikaso sa kanya kaya ako na lang po. Ako po naghahanap ng mga gulay, nagwawalis, nagliligpit ng mga gamit at nagluluto para kay Lola. Love ko po kasi talaga siya,""  ayon naman kay Alayza. Narito ang kabuuan ng post mula sa Kapuso Mo, Jessica Soho (KMJS): Read also Ogie Diaz sa umano'y bagong love life ni Barbie Imperial: ""'Yan ang aalamin natin"" Isa ang programa ng batikang broadcast journalist sa Pilipinas na si Jessica Soho sa mga pinakaaabangan ng mga Pinoy tuwing sasapit ang araw ng linggo. Bukod sa mga nakamamanghang mga kwento na kanyang naibabahagi, kapupulutan din ng aral ang mga ito kaya naman buong pamilya ang maaring manood ng kanyang programa. Isa rin sa mga naitampok sa naturang programa ang  buwis-buhay na pangunguha ng kawayan  ng isang bulag na ginagawa niyang alkansya para mailako. Tinutukan din ng marami ang kwento ng magsasakang nakatira sa bundok at nag-aararo ng walang kalabaw. Isang vlogger ang nagpanggap na pulubi at humingi ng maiinom na tubig sa magsasaka ngunit higit pa sa tubig ang naibigay nito dahil sinamahan pa niya ito ng kanin at tuyo.  Dahil dito, naisipan naman ng vlogger na bukod sa tulong pinansyal,  binigyan din niya ito ng kalabaw.","Umantig sa puso ng netizens ang maiksing video ng 5-anyos na bata na nagsisilbing mata ng lola niyang bulag. Sa mura niyang edad, halos lahat na ng gawaing bahay maging ang pagluluto ay siya na ang gumagawa. Aminado naman ang kanyang lola na naaawa sa apo subalit wala rin umano siyang magawa dahil sa kanyang kapansanan. Ayon naman sa bata, love niya ang kanyang lola kaya naman hindi niya ito pinababayaan","Sunday, May 01, 2022 at 6:27 PM",https://kami.com.ph/tagalog/142220-5-anyos-na-batang-nag-aaruga-sa-lola-na-bulag-umantig-sa-puso-ng-netizens/
"Ama ng Maguad siblings, emosyonal nang magkwento sa Bawal Judgmental","Nagpaunlak ng panayam si Cruz Maguad, ama ng Maguad siblings sa Bawal Judgmental ng Eat Bulaga. Nalaman ng  na isinalaysay muli ni Cruz ang malagim na sinapit ng kanyang mga anak sa taong kanila umanong pinagkatiwalaan. Habang nagsasalaysay at sinasariwa ang mga nangyari noong araw na natagpuan niyang duguan at wala nang buhay ang mga anak, mababakas ang sakit at pighati ng isang ama na mawalan ng dalawang pinakamamahal na mga anak. Read also Market vendor, inspirasyon ang hatid matapos manalong Mayor ng Dolores Gayunpaman, nagpapasalamat pa rin umano si Cruz sa mga taong kaanak man nila, kaibigan man at maging hindi nila kakilala ay taos-pusong nakiramay sa kanya at sa kanyang asawa.  Enjoyed reading our story?  Download  KAMI's news app on Google Play now and stay up-to-date with major Filipino news! ""Nagpapasalamat ako sa mga netizen, mga kaibigan kahit hindi namin kilala na mga netizen. Sobrang buhos sa amin ang pakikiramay, prayers alam ko yun po ang pinaka malaking tulong yung prayers nila. Alam ko pinapakinggan ni God, dahil maski papaano po, unti-unti po naiibsan ang sakit.""  Narito ang kabuuan ng kanyang pahayag mula sa Bawal Judgmental, Eat Bulaga: Disyembre 10 nang matagpuan ng kanilang ama ang magkapatid na Maguad na wala nang buhay sa kanila mismong tahanan.  Sinasabing ang adopted school girl nila ang tanging nakaligtas na nakapagtago umano sa loob ng kwarto nito. Kalaunan, inamin ng adopted school girl na isa siya sa responsable sa pagpaslang sa magkapatid habang ang isa naman ay nasa kustodiya na rin ng awtoridad at isa pala umanong sakristan. Read also VP Leni, nanawagan sa pagtanggap sa resulta ng Halalan; lalabanan pa rin ang kasinungalingan Matatandaang una nang  nanawagan si Gng. Maguad  na huwag maliitin ang kakayahan ng mga may edad na 18 pababa na nakagawa umano ng krimen sa kapwa nito kabataan. Makalipas ang mahigit dalawang buwan mula nang mapaslang ang Maguad siblings, aminadong  napakasakit pa rin para sa kanilang ina  na si Lovelle Maguad ang nangyari. Ibinahagi rin ang nasabi umano ng isa sa mga suspek sa pamamaslang sa kanilang mga anak na tila alam umanong hindi siya basta malalagak sa bilangguan.","Naging panauhin ng Bawal Judgmental ng Eat Bulaga ang ama ng Maguad siblings na si Cruz. Isinalaysay niya ang sinapit ng mga anak sa malagim na araw noong Disyembre 10 ng nakaraang taon. Hanggang ngayon, bakas pa rin sa kanya ang sakit ng hindi inaasahang nangyari sa kanyang mga anak na inakala niyang ligtas sa sarili nilang tahanan. Nagpasalamat naman si Cruz sa mga taong nagpapaabot sa kanila ng suporta at pakikiramay na kahit na paano'y nakakabawas umano ng pighati na nararamdaman nilang mag-asawa","Friday, May 06, 2022 at 11:25 PM",https://kami.com.ph/tagalog/142432-ama-ng-maguad-siblings-emosyonal-na-naibahagi-sa-eat-bulaga-ang-sinapit-ng-mga-anak/
"Mocha Uson, umalma sa pahayag ni Toni Gozaga kaugnay sa pagbabalik ni BBM sa Malacañang","Agad na nag-viral ang isang TikTok video ni Mocha Uson kung saan inilabas niya ang kanyang opinyon kaugnay sa viral na pahayag ni Toni Gonzaga kamakailan sa political rally ng UniTeam sa Cebu. Kaugnay ito sa kanyang sinabi na malapait nang magbalik si Bongbong Marcos sa kanyang tahanan at ito umano ay sa Malacañang. Read also Ellen Adarna, tinawag na ""pitbull"" ang mister na si Derek Ramsay Ang tinutukoy nitong tahanan umano ni BBM ay ang Malacañang at umani ito ng samu't-saring reaksiyon. Nilinaw ni Mocha na hindi tahanan ng sinumang pangulo ang Malacañang at pag-aari umano ito ng taong-bayan.  Enjoyed reading our story?  Download  KAMI's news app on Google Play now and stay up-to-date with major Filipino news! Aniya, maging si Pangulong Rodrigo Duterte ay sinasabing opisina lamang umano niya ang Malacañang. Kaya naman, sana umano ay matuto si Toni kay Pangulong Duterte. Si Toni Gonzaga ay nakilala sa kanyang husay sa pagiging isng TV host at mang-aawit. Kapatid siya ng YouTube star na si Alex Gonzaga at ikinasal siya sa direktor na si Paul Soriano. Matapos ang pagsara ng ABS-CBN, marami sa mga artista ang napilitang gumawa ng YouTube content para kahit papaano ay may pagkakakitaan na rin. Unti-unti ngayong nakikilala ng Toni Talks segment ni Toni kung saan nag-iinterview siya ng ilang mga sikat na mga celebrites kagaya na lamang kanyang kapatid na si Alex, ang mag-asawang  Hayden Kho at Vicki Belo  at kamakailan lang ay si  Melai Cantiveros.",Sa isang TikTok video ay naghayag ng kanyang saloobin si Mocha Uson kaugnay sa kontrobersiyal na pahayag ni Toni Gonzaga. Kaugnay ito sa kanyang sinabi na malapait nang magbalik si Bongbong Marcos sa kanyang tahanan. Ang tinutukoy nitong tahanan umano ni BBM ay ang Malacañang at umani ito ng samu't-saring reaksiyon. Nilinaw ni Mocha na hindi tahanan ng sinumang pangulo ang Malacañang at pag-aari umano ito ng taong-bayan,"Wednesday, April 20, 2022 at 11:59 PM",https://kami.com.ph/tagalog/141876-mocha-uson-umalma-sa-pahayag-ni-toni-gozaga-kaugnay-sa-pagbabalik-ni-bbm-sa-malacanang/
"Ama ng Maguad siblings, labis-labis pa rin ang pangungulila sa mga anak","Talagang nangungulila pa rin ang ama ng umano'y pinaslang na Maguad siblings na si Ginoong Cruz Magulang. Nalaman ng  na bumuhos ang mensaheng pampalakas ng loob ni Cruz sa karumaldumal na nangyari sa kanyang mga anak noon. Ayon sa kanyang Facebook post, tila hindi na umano hustisya at kaparusahan ang kanyang kailangan ngayon kundi ang makasama muli ang mga anak na miss na miss na umano niya. Read also Boots Anson Roa, ayaw na umano sa diktadurya; ""Ang presidente ko ay si Leni Robredo"" ""And I realized...it's not maximum justice for my kids...it's not maximum penalty to the criminals is what I need...but all I need is to be with my kids...I really missed you and love you so much mga anak...""  Enjoyed reading our story?  Download  KAMI's news app on Google Play now and stay up-to-date with major Filipino news! Narito ang kabuuan ng kanyang pahayag: Disyembre 10 nang matagpuan ng kanilang ama ang magkapatid na Maguad na wala nang buhay sa kanila mismong tahanan.  Sinasabing ang adopted school girl nila ang tanging nakaligtas na nakapagtago umano sa loob ng kwarto nito. Kalaunan, inamin ng adopted school girl na isa siya sa responsable sa pagpaslang sa magkapatid habang ang isa naman ay nasa kustodiya na rin ng awtoridad at isa pala umanong sakristan. Matatandaang una nang nanawagan  si Gng. Maguad  na huwag maliitin ang kakayahan ng mga may edad na 18 pababa na nakagawa umano ng krimen sa kapwa nito kabataan. Read also Lyca Gairanod, hindi napigil ang emosyon nang makita ang kalagayan ng ama Makalipas ang mahigit dalawang buwan mula nang mapaslang ang Maguad siblings, aminadong napakasakit pa rin para  sa kanilang ina na si Lovelle Maguad  ang nangyari. Ibinahagi rin ang nasabi umano ng isa sa mga suspek sa pamamaslang sa kanilang mga anak na tila alam umanong hindi siya basta malalagak sa bilangguan.","Labis-labis pa rin ang pangungulila ng ama ng pinaslang na Maguad siblings noong nakaraang taon. Aniya, napagtanto niyang hindi ang hustisya at parusa ang kailangan nila kundi ang pagkakataong makasama muli ang mga anak. Makalipas ang ilang buwan, mararamdaman pa rin ang sakit at hinagpis nilang mag-asawa. Sa huling update naman ng ina ng magkapatid na Maguad, tila hindi niya umano kinakitaan ng pagsisisi ang mga umano'y salarin ng pagkamatay ng kanyang mga anak","Tuesday, April 26, 2022 at 11:22 PM",https://kami.com.ph/tagalog/142058-ama-ng-maguad-siblings-labis-na-nangungulila-sa-mga-anak/
