title,article_text,summary,article_date,source
"Ina ng napaslang na Grab driver na si Jang Lucero, nanawagan ng tulong sa publiko","Humiling ng tulong si Angela Lucero, ina ng napaslang na lady driver na si Jang Lucero. Nais niyang matunton na kaagad ang suspek umano sa pagpaslang sa anak na aniya ay mayroon nang warrant of arrest. Sa kanyang  post  ay diretsahan niyang pinangalanan ang tinutukoy niyang suspek. Matatandaang gumimbal sa marami ang balita tungkol sa pagkakapaslang sa lady driver na si Jang noong June 28, 2020. Read also Vice Ganda, aminadong hindi naging madali ang pinagdadaanan Sa nalalapit na 28 ay magdadalawang taon na ang kanyang kamatayan at marami sa mga netizens ang umaasa na sana ay mabigyan na ito ng hustisya. Si Robyn Jang Lucero ay ang lady driver na natagpuang tadtad ng saksak sa Calamba, Laguna. Dahil sa tindi ng tinamong saksak ni Jang, marami sa mga netizens ang nais makatulong upang mabigyan ng ito ng hustisya. Nauna nang naaresto ang dating kasintahan ni Meyah na si Ann Sheila Montes Belarmino. Gayunpaman, dahil sa kakulangan umano ng ebidensiya, pinakawalan din si Belarmino. Iginiit ng kanyang abogado na hindi siya ang pumaslang kay Jang. Matapos mapakawalan ay naghayag ng kanyang pasasalamat si Belarmino dahil sa mga taong nagtiwala umano sa kanya.  Naiiyak umano siya habang ginagawa ang mensahe niya ng pasasalamat sa pamamagitan ng isang Facebook post. Matatandaang idinulog ng ina ni Jang sa  programa ni Erwin Tulfo na ""Tutok Tulfo""  para humingi ng tulong sa paghahanap ng hustisya para sa pagkapaslang sa kanyang anak. Nais niyang mapaembistigahan ang karelasyon ng anak na si Meyah Amatorio matapos niyang makatanggap ng mga kopya ng umano'y mga mensahe ng anak na nagpapakita ng kanyang mga pasa na gawa ng karelasyon dahil nais na nitong makipaghiwalay kay Meyah.","Humingi ng tulong ang ina ni Jang Lucero para mapabilis na matunton ang aniya'y suspek sa pagpatay sa kanyang anak. Sa isang post ay nasabi ng ina ng napaslang na lady driver na may warrant na umano sa suspect mula sa Branch 105 Calamba, Laguna. Matatandaang gumimbal sa marami ang balita tungkol sa pagkakapaslang sa lady driver na si Jang noong June 28, 2020. Sa nalalapit na ikalawang taon ng kanyang pagpanaw, marami ang humihiling na sana ay makamit na nito ang hustisya","Wednesday, June 22, 2022 at 3:40 AM",https://kami.com.ph/tagalog/143976-ina-ng-napaslang-na-rab-driver-na-si-jang-lucero-nanawagan-ng-tulong-sa-publiko/
"Estudyante, hindi umano pinaakyat ng stage para sa diploma dahil late nakabayad ng grad fee","Agaw-eksena sa social media ang nangyari kamakailan sa graduating student na si John Marcelino Rosaldo ng Lorma Colleges sa La Union. Nalaman ng  na hindi umano ito napaakyat ng entablado upang tanggapin ang diploma niya sa pagtatapos ng kursong nursing. Ang kapatid ni John Marcelino na si Celene Rosaldo ang umano'y naglabas ng hinaing ukol sa nangyari. Sa kanyang TikTok video, ipinakita ang kapatid na naglabas umano ng saloobin sa pag-aalis umano rito sa pila nang papaakyat na umano sila sa entablado para tanggapin ang diploma. Read also Bea Alonzo, kinuwentong tatlong taong hindi sila nagpansinan ni John Lloyd Cruz   check out news exactly   ➡️  find ""Recommended for you""  block and enjoy! Ayon sa  PEP , ginanap ito noong Hunyo 23. May caption ang post ni Celene na: ""Yung graduate ka pero di ka pinaakyat ng stage para kunin diploma mo kasi di naconfirm payment mo sa grad fee.” Sa ulat ng  Bandera , sinabing isang araw bago ang graduation ay nakapagbayad naman umano si John Marcelino ng kanyang graduation fees. Subalit hindi raw ito na-confirm agad dahilan upang mangyari ang hindi nito pag-akyat nsa entablado. ""Ang pinaka-masakit po dun ay yung hitsura ng nanay ko po na kitang-kita niya na yung anak niya na pinull out sa line papuntang stage upang i-receive sana yung diploma,"" ayon kay Celene sa panayam sa kanya ng  Manila Bulletin . Dahil panahon ngayon ng Graduation at Moving-Up ceremonies, Ilang post ukol dito ang nag-viral kamakailan. Read also Patillas Girl sa relasyon nila ni Flow G: ""'Yung tiwala ko never naman niyang nadungisan"" Isa na rito ang video ng ama na dala ang  standee  ng anak na hindi na makadadalo sa kanyang Pagtatapos. Ito ay dahil sa namayapa na ang anak bago pa man maganap ang pinakhihintay nitong Graduation day. Marami ang nadurog ang puso sa naturang video. Samantala, nag-viral din ang video ng isang  online seller  na naaktuhan ang kanyang reaksyon nang malaman niyang pasado siya sa Licensure Examination. Dahil naka-live siya, kitang-kita ang kanyang kasayahan nang malamang isa na siyang lisensyadong guro.","Viral ang post ng isang graduating student na hindi umano pinaakyat ng entablado. Ang dahilan umano ay ang late na pagbabayad nito ng graduation fee. Bagaman at nabayaran, isang araw bago ang seremonya, hindi raw ito agad naaprubahan. Sa kabila ng nangyari, hindi ininda ng estudyante ang di niya pag-akyat ng entablado kundi ang reaksyon ng ina sa naturang eksena","Sunday, June 26, 2022 at 9:07 PM",https://kami.com.ph/tagalog/144109-estudyante-hindi-umano-pinaakyat-ng-stage-para-kunin-ang-diploma-dahil-late-nakabayad-ng-grad-fee/
"Mrs. Maguad, emosyonal nang makita ang picture ng mga kaklase ng anak","Naiyak umano si Mrs. Lovella Maguad nang makita niya ang picture ng mga kaklase ng anak niyang si Crizvlle Louis Maguad. Hawak ng isa sa kanila ang picture frame kung saan nakalagay ang picture ng anak. Hindi mapigilan ni Mrs. Maguad na malungkot lalo nang maalalang wala na umanong pag-asa na maabot pa ng anak ang pangarap nitong maging abogado at architect. Sobra umano siyang nasaktan. Read also Annabelle Rama, binuking na araw-araw umanong umiiyak si Ruffa Guttierez Pangarap umano ng anak niya na mapatayuan silang mag-asawa ng double-storey modern  house na my swimming pool. Pinasalamatan at binati ni Mrs. Maguad ang mga kaklase at kaibigan ng kanyang anak sa araw ng kanilang pagtatapos sa high school. Ang kaso ng pagpaslang sa magkapatid na Maguad ay lumikha ng malaking ingay lalo at naganap ang pagpaslang sa magkapatid sa mismong bahay nila. Ang lalong naging kahindik-hindik ay nang mapag-alamang mismong ang dalagang kanilang kinupkop at itinuring na kapamilya ang isa sa mga salarin sa pagpaslang. Read also Zeinab Harake, pinanindigang hindi na umano siya marupok Samantala, ibinahagi ng ina ng magkapatid ang kanyang hinanakit nang makaharap nila ang mga salarin sa pagpaslang sa kanilang dalawang anak,  wala umano silang magawa . Sa kanilang mga social media account, ay madalas na inihahayag ng mag-asawa ang kanilang saloobin sa gitna ng kanilang pighati at pagnanais na mabigyan ng katarungan ang pagkamatay ng dalawang mga anak nitong mga nakaraang buwan. Matatandaang  umamin ang mismong dalaga  sa kanyang ginawa ilang araw matapos ang pamamaslang sa magkapatid. Hindi naman maitago ng mag-asawang Maguad ang kanilang paghihinagpis matapos ibaba ang hatol sa dalawang akusado sa pagpaslang sa kanilang dalawang anak.","Ibinahagi ni Mrs. Lovella Maguad ang kanyang saloobin nang makita ang class picture ng mga kaklase ng anak na si Crizvlle Louis Maguad. Hawak ng isa sa kanila ang picture frame kung saan nakalagay ang picture ng anak. Aniya, naiyak siya nang makita niya iyon dahil naalala niya na wala na umanong pag-asa na maabot pa ng anak ang pangarap nitong maging abogado at architect. Pangarap umano ng anak niya na mapatayuan silang mag-asawa ng double-storey modern  house na my swimming pool","Wednesday, June 15, 2022 at 10:21 PM",https://kami.com.ph/tagalog/143780-mrs-maguad-emosyonal-nang-makita-ang-class-picture-ng-kaklase-ng-anak/
"Lorma Colleges, 'di na raw sinagot ng estudyanteng 'di umano pinaakyat ng stage","Naglabas ng opisyal na pahayag ang Lorma Colleges kaugnay sa kontrobersyal na video kamakailan ng graduating student na si John Marcelino Rosaldo. Nalaman ng  na sinubukan na umanong makipag-ugnayan ng nasabing paaralan sa estudyante nilang inalis umano sa pila bago pa man makaakyat sa entablado upang tanggapin sana ang kanyang diploma noong Hunyo 23. Read also Cristy Fermin, biglang naalala ang panahong naghiwalay sina Dennis Padilla, Marjorie Barretto ""I requested for us to meet over the weekend, but the family has declined as of yesterday, June 26,""  ang bahagi ng pahayag ni Dr. Carol Lynn R. Macagba, President, LORMA Colleges. Sinasabing naimbestigahan na nila umano ang pangyayari at may ilan sila umanong natuklasan umano sa sitwasyon. Read also Cristy Fermin, sinabing may punto si Leon Barretto sa open letter niya kay Dennis Padilla Narito ang kabuuan ng kanilang pahayag: Ang kapatid ni John Marcelino na si Celene Rosaldo  ang umano'y naglabas ng hinaing ukol sa nangyari. Sa kanyang  TikTok video , ipinakita ang kapatid na naglabas umano ng saloobin sa pag-aalis umano rito sa pila nang papaakyat na umano sila sa entablado para tanggapin ang diploma. Ayon sa PEP, ginanap ito noong Hunyo 23. May caption ang post ni Celene na: ""Yung graduate ka pero di ka pinaakyat ng stage para kunin diploma mo kasi di na-confirm payment mo sa grad fee.” Sa ulat ng  Bandera , sinabing isang araw bago ang graduation ay nakapagbayad naman umano si John Marcelino ng kanyang graduation fees. Subalit hindi raw ito na-confirm agad dahilan upang mangyari ang hindi nito pag-akyat sa entablado. ""Ang pinaka-masakit po dun ay yung hitsura ng nanay ko po na kitang-kita niya na yung anak niya na pinull out sa line papuntang stage upang i-receive sana yung diploma,""  ayon kay Celene sa panayam sa kanya ng  Manila Bulletin.","Muling naglabas ng pahayag ang paaralan ng nag-viral na graduating student kamakailan. Ito ay kaugnay sa pag-aalis umano sa pila ng naturang graduating student na noo'y papanhik na sana ng entablado para tanggapin ang diploma. Sinasabing may kaugnayan ito sa hindi agad nabayarang graduation fee ng estudyante na hindi rin agad nakumpirma matapos bayaran. Hanggang ngayon, hindi pa rin umano sumasagot ang pamilya ng estudyante sa hiling ng paaralan na makipag-usap sa kanila","Tuesday, June 28, 2022 at 11:13 PM",https://kami.com.ph/tagalog/144199-lorma-colleges-naglabas-muli-ng-pahayag-ukol-sa-graduating-student-na-umanoy-di-pinaakyat-ng-stage/
"Lorma College, nagsalita na ukol sa graduating student na umano'y di pinaakyat ng stage","Nagbigay na ng pahayag ang Lorma Colleges kaugnay sa viral video ng estudyante nilang hindi nakaakyat umano ng entablado sa kanilang graduation. Nalaman ng   na nangyari ito noong Hunyo 23 kung saan inalis sa pila ng mga tatanggap ng diploma sa entablado si John Marcelino Rosaldo. Aniya, ito raw ay dahil sa hindi agad nakumpirma ang kanyang graduation fee na nabayaran naman, isang araw bago seremonya. Read also Estudyante, hindi umano pinaakyat ng stage para sa diploma dahil late nakabayad ng grad fee  ""We are deeply concerned and saddened by what transpired during the recent graduation ceremony,""  panimula ng pahayag.  Ayon din sa pahayag ng paaralan, sinusubukan nilang makipag-ugnayan sa pamilya ng estudyante at iniimbestigahan na nila ang naturang insidente. ""Our formal statement will be released as soon as possible.We thank you for your continued trust,""  pahayag ni Dr. Carol Lynn R. Macagba, President, LORMA Colleges. Narito ang kabuuan ng pahayag: Ang kapatid ni John Marcelino na si Celene Rosaldo ang umano'y naglabas ng hinaing ukol sa nangyari. Sa kanyang  TikTok video , ipinakita ang kapatid na naglabas umano ng saloobin sa pag-aalis umano rito sa pila nang papaakyat na umano sila sa entablado para tanggapin ang diploma. Ayon sa PEP, ginanap ito noong Hunyo 23. May caption ang post ni Celene na: ""Yung graduate ka pero di ka pinaakyat ng stage para kunin diploma mo kasi di na-confirm payment mo sa grad fee.” Read also Patillas Girl sa relasyon nila ni Flow G: ""'Yung tiwala ko never naman niyang nadungisan"" Sa ulat ng Bandera, sinabing isang araw bago ang graduation ay nakapagbayad naman umano si John Marcelino ng kanyang  graduation  fees. Subalit hindi raw ito na-confirm agad dahilan upang mangyari ang hindi nito pag-akyat sa entablado. ""Ang pinaka-masakit po dun ay yung hitsura ng nanay ko po na kitang-kita niya na yung anak niya na pinull out sa line papuntang stage upang i-receive sana yung diploma,"" ayon kay Celene sa panayam sa kanya ng Manila Bulletin.","Nagbigay pahayag na ang paaralan ng nag-viral na nursing graduate na umano'y hindi pinaakyat ng entablado. Matatandaang nag-viral ang video niya matapos ikwentong hindi niya nakuha ang diploma sa dapat sana'y pag-akyat niya ng entablado. Nalungkot estudyante hindi dahil sa hindi siya umakyat sa stage ng graduation kundi ang sa reaksyon ng ina sa nangyari. Ayon sa Lorma Colleges, iimbestigahan nila umano ang nangyari sa insidente","Monday, June 27, 2022 at 12:01 AM",https://kami.com.ph/tagalog/144141-lorma-college-naglabas-na-ng-pahayag-ukol-sa-graduating-student-na-umanoy-di-pinaakyat-ng-stage/
"SHS, ipinagmalaki pa ang ama kahit 'di na nakapagbihis para sa kanyang graduation","Viral ang post ng isang senior high school graduate na proud sa kanyang ama. Nalaman ng   na isa umanong backhoe operator ang ama ng estudyanteng si Guillerma Idias na sinikap na makadalo pa rin sa kanyang Pagtatapos. Umantig sa puso ng marami ang larawan ni Guillerma at amang si Florentino na hindi na umano nakapagpalit pa ng damit mula sa trabaho. Read also Julia Barretto at mga kapatid, naihalintulad umano ng netizens sa mga anak ni Ruffa ""Sabi ko kay papa, 'Picture tayong dalawa.' Ta's sabi ni papa, 'Wag na lang kasi hindi ako nakapagbihis. Ang dumi at ang basa ko pa. Pero sabi ko, ""e ano kung madumi ang damit at basa na, wala akong pake hindi kita kinakahiya, bahala kahit hindi ka pa nakapagbihis,”  ang caption ng post ni Guillerma sa wikang Cebuano. ""Thankful ako na nandito ka sa graduation ko, kahit na pagod ka galing sa trabaho, dumeretso ka talaga sa graduation ko, kahit na basa ka pa, Pa,""  ang pasasalamat pa ni Guillerma sa ama na kahit mababakas ang pagod sa trabaho ay nakangiti pa rin sa espesyal na araw ng kanyang anak. Narito ang larawan ng mag-amang ibinahagi rin ng  Inquirer : Kamakailan, nag-viral naman ang  isang TikTok video  kung saan isa umanong Nursing graduate ang hindi nakaakyat ng entablado para tanggapin ang kanyang diploma. Read also Lorma College, nagsalita na ukol sa graduating student na umano'y di pinaakyat ng stage Nakilala ang naturang nursing grad na si John Marcelino Rosaldo at ang kanyang kapatid na si Celene ang naglabas umano ng hinaing sa nangyari. Sinasabing tinanggal umano sa pila ng kukuha ng diploma si John Marcelino dahil hindi pa raw kumpirmado ang graduation fee nito. Naglabas na rin ng pahayag ang paaralan  ni John Marcelino at sinabing makailang beses na silang sumubok na kausapin ang kanilang estudyante at pamilya nito subalit hindi umano sila nakatanggap ng anumang sagot mula sa mga ito.","Umantig sa puso ng marami ang viral post ng isang senior high school graduate na kasama ang kanyang ama. Mapapansing hindi na nakapagpalit pa ng damit ang ama para sa espesyal na okasyon ng anak. Subalit, hindi raw ikinahiya ng anak ang ama at masayang nakipag-picture pa rito. Pinasalamatan din ng anak ang ama na kahit pagod umano sa trabaho ay sinikap pa rin na dumalo sa Pagtatapos nito","Wednesday, June 29, 2022 at 11:19 PM",https://kami.com.ph/tagalog/144223-shs-graduate-umantig-sa-puso-ng-netizens-nang-ipagmalaki-ang-ama/
"RTIA, bumitiw na sa kaso ng sekyu na binundol ng SUV; SG ayaw na magpatulong","Binitawan na ni Sen. Raffy Tulfo ang pagtulong sa kaso ng sekyu na binundol ng SUV sa Mandaluyong. Tumatanggi na umano sa kanilang tulong ang SG kaya napagtanto nilang hindi na interesado na magpatulong sa kanila ang SG. Read also Ivana Alawi, pinasundo ang helper gamit ang chopper para isurpresa ng Belo makeover Ayon sa reporter ng RTIA, sinabi umano ng GS na confidential ang kanyang location kaya hindi na nakapunta ang reporter ng RTIA para magbigay ng tulong kahit walang camera. Ayon kay Sen. Tulfo hindi nila pinagpipilitan kung ayaw na ng tulong ng complainant at madalas umanong nangyayari ang pagbitaw na magpatulong sa kanila. Nirerespeto umano nila ang desisyon ng mga complainant. Malinaw na umano sa kanila na ayaw nang magpatulong ng complainant kaya bumitaw na sila. Isa-isang pinasalamatan ni Sen. Tulfo ang mga taong tumulong at maging ang complainant at ang kanyang kapatid na lumapit sa programang RTIA. Matatandaang nag-viral ang video ng isang security guard na binundol ng RAV-4 sa Mandaluyong habang nagmamando ng daloy ng trapiko. Umani ng matinding komento at reaksiyon mula sa publiko ang naturang insidente. Read also Babae sa India na tila napagod na sa paghihintay kay ""Mr. Right"", pinakasalan na lang ang sarili Kabilang si Senator JV Ejercito sa naghayag ng kanyang  pagkondena sa nagmamaneho ng RAV-4 na bumundol at ginulungan ang security guard.  Nag-alok siya ng pabuya na P50,000 para sa makakapagbigay ng impormasyon tungkol sa driver. Binigay niya rin ang ilang detalye ng SUV pati ang plate number nito. Hindi dumalo sa LTO hearing ang driver ng RAV-4  kaya naglabas ng show-cause order ang LTO na nangangailangan ng kanyang presensiya sa LTO office. Dito ay pinagpapaliwanag ang driver bakit hindi siya dapat sampahan ng administrative case for reckless driving at kung bakit hindi dapat i-revoke ang kanyang lisensiya.","Ito ay matapos umano nilang mapagtanto na tila hindi na interesado na magpatulong sa kanila ang kampo ng SG. Ayon sa reporter ng RTIA, sinabi umano ng GS na confidential ang kanyang location kaya hindi na nakapunta ang reporter ng RTIA para magbigay ng tulong kahit walang camera. Sinabi din umano nito na okay na sa kanya kahit ang abogado na lamang ng security agency niya ang hahawak sa kaso sa kabila ng alok ng RTIA na magbibigay sila ng libreng abogado para tumulong sa kaso","Thursday, June 16, 2022 at 5:44 PM",https://kami.com.ph/tagalog/143796-raffy-tulfo-action-bumitiw-na-sa-kaso-ng-sekyu-na-binundol-ng-suv/
"Ina ni Jang Lucero, ginunita ang ikalawang taon ng pagkamatay ng anak","Ayon sa ina ni Jang Lucero, hindi siya titigil sa paghahanap ng hustisya para sa anak. Hindi umano siya papayag na masaya ang taong kumitil sa buhay ng anak na marami pang pangarap sa buhay. Read also Jose Hallorina, sinabing natalo niya si Donnalyn Bartolome sa kaso Sa kanyang paggunita sa ikalawang taon ng kamatayan ng anak, inamin niyang mahirap pa rin para sa kanya na tanggapin ang pagkawala ng kanyang anak ngunit aniya ay kailangan niyang magpakatatag para maipaglaban niya ang hustisya para sa anak. Matatandaang sa  naunang post  niya ay sinabi niyang may ibinaba nang warrant of arrest para sa salarin sa pagpaslang sa anak.   Si Robyn Jang Lucero ay ang lady driver na natagpuang tadtad ng saksak sa Calamba, Laguna. Dahil sa tindi ng tinamong saksak ni Jang, marami sa mga netizens ang nais makatulong upang mabigyan ng ito ng hustisya. Nauna nang naaresto ang dating kasintahan ni Meyah na si Ann Sheila Montes Belarmino. Gayunpaman, dahil sa kakulangan umano ng ebidensiya, pinakawalan din si Belarmino. Iginiit ng kanyang abogado na hindi siya ang pumaslang kay Jang. Matapos mapakawalan ay naghayag ng kanyang pasasalamat si Belarmino dahil sa mga taong nagtiwala umano sa kanya.  Naiiyak umano siya habang ginagawa ang mensahe niya ng pasasalamat sa pamamagitan ng isang Facebook post. Matatandaang idinulog ng ina ni Jang sa  programa ni Erwin Tulfo na ""Tutok Tulfo"" para humingi ng tulong sa paghahanap ng hustisya para sa pagkapaslang sa kanyang anak . Nais niyang mapaembistigahan ang karelasyon ng anak na si Meyah Amatorio matapos niyang makatanggap ng mga kopya ng umano'y mga mensahe ng anak na nagpapakita ng kanyang mga pasa na gawa ng karelasyon dahil nais na nitong makipaghiwalay kay Meyah.","Ginunita ng ina ni Jang Lucero ang ika-dalawang taon ng kanyang kamatayan sa isang Facebook post nito. Ngayong June 28, nag-post ang ina ni Jang na si Angela Lucero na sa kanyang paggunita sa ikalawang taon ng pagkamatay ng anak ay hindi siya titigil sa paghahanap ng hustisya para sa anak. Hindi umano siya papayag na masaya ang taong kumitil sa buhay ng anak na marami pang pangarap sa buhay. Si Robyn Jang Lucero ay ang lady driver na natagpuang tadtad ng saksak sa Calamba, Laguna noong June 28, 2020","Wednesday, June 29, 2022 at 11:29 PM",https://kami.com.ph/tagalog/144219-ina-ni-jang-lucero-ginunita-ang-ikalawang-taon-ng-pagkamatay-ng-anak/
"Party na kaunti lang ang dumalo, nakapagpasaya ng hinakot na mga bata sa kalye","Viral ang nakatutuwang video ng isang birthday party na nagawang maghakot ng mga bisita na bata sa kalye sa Davao City. Nalaman ng na kakaunti umano ang nakarating sa birthday party ng walong taong gulang na batang si Xander King kaya naman naisipan ng kanilang pamilya na maghakot na lamang ng mga batang mabibigyang saya rin nila sa nasabing handaan. Read also Honor student, emosyonal sa kanyang graduation nang biglang sumulpot ang inang OFW Kwento ng ina ni Xander na si Ivy Florez Raz sa  ABS-CBN , lima lamang sa mga imbitado nilang bata ang nakadalo sa oras gayung ang iba ay sa gabi pa makararating. Kaya naman para maging extra special pa lalo ang kaarawan ng kanyang anak, pinasaya rin nila ang mga bata sa kalye sa pamamagitan ng pagkain at mga palaro.   Siniguro rin ng pamilya ni Xander na naihatid din ang mga nahakot na bago niyang mga kaibigan sa kung saan sila nasundo. Nag-uwi rin ito ng mga pagkain, pera at premyo. Samantala, kamakailan ay nag-viral din online ang video ng isang PWD na  sinurpresa umano ng mga service crew  at manager ng kinainang  fast food chain . Ayon sa uploader na siyang branch manager din ng resto, mag-isa lamang ang naturang customer at nang iabot nito ang PWD card, doon nila nalamang kaarawan pala nito. Read also Herlene Budol, naging daan para makita ang lolo na inakalang patay na ng kanyang pamilya Kaya naman hindi sila nagdalawang-isip na isurpresa ito ng lobo at ilang pirasong pancake para makapag-blow ito ng birthday candle. Napag-alaman din nilang patungo pala itong ospital para magpa-insulin. Labis ang pasasalamat ng customer na talagang naiyak sa hindi inaasahang regalo sa kanya ng mga crew. Umani ng papuri ang store manager at mga kasama nito na nakapagpasaya ng taong nag-iisa lamang sa kanyang kaarawan.","Viral ang video ng birthday party na nakapagpasaya ng mga bata sa kalye. Ayon sa ina ng may birthday, lima lamang sa mga imbitado ang dumating sa oras. Dahil dito, naisipan nilang maghakot ng mga bata sa kalye upang dumami ang bisita at makapag-enjoy ang may kaarawan. Makikitang nag-enjoy naman ang mga bata sa pakain, palaro at perang ibinigay sa kanya at hinatid din sila kung saan sila nasundo","Thursday, July 21, 2022 at 11:50 PM",https://kami.com.ph/tagalog/144941-birthday-party-na-kaunti-lang-ang-dumalo-nakapagpasaya-ng-mga-hinakot-na-batang-kalye/
"Mayor Vico, sa 'di pagsagot sa tanong ukol sa love life; ""Parang nagiging distraction siya""","Hindi na pala umano sumasagot ng mga tanong ukol sa kanyang buhay pag-ibig si Mayor Vico Sotto ng Pasig City. Nalaman ng   isa kasi ito sa mga tanong kanya ni Ogie Diaz subalit ipinaliwanag ng alkalde kung bakit pinili niyang itikom ang bibig ukol sa ganoong usapin. ""Early 2019, bago ako naging mayor, maraming nagtatanong ng ganyan. Ako siyempre 'pag  may nagtanong sa akin, sasagot ako. Ang problema, laging 'yun ang nagiging viral. Kung anong sagot ko, kung magbiro man ako 'dun... Nagtatrabaho tayo dito, may mga project tayo, hindi napapansin. 'Yung napapansin, 'yung mga sagot ko sa ganoong tanong. Siguro mga end of 2019, hindi na ako sasagot ng tanong tungkol sa love life,""  aniya. Read also Mayor Vico, nakatutok sa serbisyo sa Pasig kaysa sa pagbibigay ng apo kina Vic At Coney ""Parang naging distraction siya na ito 'yung napapansin... Baka isipin puro ganoon lang ang ginagawa ko... Hindi naman tayo nandito para magpa-cute, nandito tayo para magtrabaho"" dagdag pa niya.   Narito ang kabuuan ng panayam sa kanya ni Ogie Diaz: Si  Mayor Vico Sotto  ang kasalukuyang alkalde ng Pasig City na nanunungkulan sa kanyang ikalawang termino. Anak siya ng mga batikang mga artista at host sa bansa na sina Vic Sotto at Coney Reyes. Pinakakaabangan ng marami ang mga video ni Ogie Diaz sa kanyang  YouTube channel s na ""Ogie Diaz"" at ""Ogie Diaz Showbiz Updates"" dahil sa mga maiinit na showbiz balita at interview sa mga artista at iba pang kilalang personalidad na nagbibigay inspirasyon sa marami. Maliban sa mga latest Showbiz Updates, nagbibigay inspirasyon naman ang interviews ni Ogie Diaz sa mga kilalang personalidad lalo na ang mga kwento ng kanilang buhay na talaga namang kapupulutan ng aral. Ilan sa mga nakapanayam niya kamakailan ay ang kilalang half man skateboarder na si Kevin Almazan.","Isa sa mga naitanong ni Ogie Diaz kay Mayo Vico Sotto ay ang tungkol sa kanyang love life. Subalit, matagal na pala umanong isinasantabi ni Mayor Vico ang pagsagot sa katanungan ukol sa kanyang buhay pag-ibig. Aniya, ayaw niyang isipin ng mga tao na puro 'pagpapa-cute ang kanyang ginagawa. Mas gusto niya umanong mapansin ng publiko ang serbisyo sa lungsod na bunga ng kanyang mga sakripisyo at dedikasyon sa kanyang pamumuno","Sunday, July 24, 2022 at 12:59 AM",https://kami.com.ph/tagalog/145010-ogie-diaz-natawa-nang-malamang-hindi-na-pala-sumasagot-ng-tanong-ukol-sa-love-life-si-mayor-vico/
