title,article_text,article_date,source
"Tangkang pagdukot ng puting van sa 13-anyos, gawa-gawa lang Caloocan City Police","MANILA, Philippines — Naniniwala si Caloocan City Police chief Col. Samuel Mina, Jr. na posibleng gawa- gawa lamang ng 13-anyos na dalagita ang umano’y tangkang pagdukot sa kanya ng puting van sa lungsod, ka­makailan.,Ayon kay Mina, ni-review nila ang closed-circuit te­levision (CCTV) cameras malapit sa Del Rey Village 3 sa Barangay 162 subalit wala silang nakitang puting van na nakaparada.,Ito ang lugar na sinasabi ng  biktima na may nakaparadang isang puting van at lumabas ang tatlong lalaki na tinangka siyang dukutin.,“Lahat ng allegations niya ay backtracked through CCTV footages malapit sa sinasabing pinangyarihan, which is less than 100 meters away from the police substation and in front of the barangay hall,” ani Mina.,Lahat aniya ng  dapat pagbasehan ay ginawa nila kabilang  ang lugar kung saan lumilitaw na mahihirapan ang mga kidnappers na isagawa ang pagdukot dahil maraming tao sa lugar  at daanan ng mga truck.,Hindi rin tugma ang testimonya ng dalagita sa testimonya ng barangay officials at tricycle driver.,Nabatid pa kay Mina na maaaring may problema sa pag-aaral ang dalagita at ayaw na nitong mag-aral. Dahil dito kailangan na sumailalim ang dalagita sa counselling.,Sa kabila nito, sinabi ni Mina na hindi sila pakakampante at paiigtingin pa rin nila ang kanilang police visibi­lity ngayong nagsimula na ang klase.","August 27, 2022  12:00am",https://www.philstar.com/pilipino-star-ngayon/metro/2022/08/27/2205499/tangkang-pagdukot-ng-puting-van-sa-13-anyos-gawa-gawa-lang-caloocan-city-police
"Malawakang pagbaha sa Metro Manila, naitala; coding, suspindido","MANILA, Philippines — Nakapagtala ang Metropolitan Manila Development Authority (MMDA) ng malawakang pagbaha sa ilang lugar sa Metro Manila kahapon bunsod ng pananalasa ng bagyong Florita.,Kaugnay nito, sinuspinde rin ng MMDA ang implementasyon ng number coding scheme kahapon matapos ang suspensiyon ng Malacañang sa klase at trabaho sa rehiyon at mga kalapit na lalawigan.,“In view of the suspension of work and classes by Malacañang and due to heavy rains, the number coding scheme is suspended [Tuesday and Wednesday,]” anang MMDA.,Anang ahensiya, kabilang sa mga lugar na nakaranas ng mga pagbaha ay ang ilang lugar sa Quezon City.,Nakapagtala rin umano sila ng gutter-deep flooding sa EDSA Dario Bridge Northbound lane hanggang alas-12:00 ng tanghali,Binaha rin ang Commonwealth Tandang Sora patungong Elliptical, Commonwealth Dona Carmen, Commonwealth Regalado at maging ang EDSA Aurora tunnel southbound.,Nakaranas din ng pagbaha sa Sgt. Rivera gayundin sa Araneta Victory Liner at iba pang mga lugar.,Alas-12:39 ng tanghali nang umakyat sa 12 pulgada ang baha sa may interseksyon ng Sgt. Rivera at A. Bonifacio, ngunit nadaraanan pa rin naman ng mga behikulo.,Ala-1:59 nang tumaas din ang baha sa may Araneta Victory ng hanggang gutter deep (8 inches).,Dahil din sa lakas ng agos sa Ilog Pasig, sinuspinde rin kahapon ng MMDA ang operasyon ng Pasig River Ferry Service.,Sa Maynila, sinabi ng Information Office nito na wala silang namonitor na pagbabaha sa siyudad maging sa mga lugar na regular na nilulubog ng baha.","August 24, 2022  12:00am",https://www.philstar.com/pilipino-star-ngayon/metro/2022/08/24/2204696/malawakang-pagbaha-sa-metro-manila-naitala-coding-suspindido
"7 job scammer sa Facebook, timbog","MANILA, Philippines — Arestado ang pitong katao na diumano’y nasa likod ng pambibiktima ng online jobseekers sa isinagawang operasyon ng Philippine National Police’s Anti-Cybercrime Group (ACG) sa Pasay City, nitong Martes.,Kinilala ni ACG chief Brig. Gen. Joel Doria ang mga suspek na sina Kimberly Santillan, 43; Rosalie Verceles, 53; Lailani Bregoli, 25; Mary Jane Cuevas, 24; Zenaida Navarro, 47; Mary Jane Reyes, 46; at Simone Louise Austria, 21, na pawang nadakip sa pagsalakay sa isang gusali sa panulukan ng Epifanio de los Santos Avenue at Taft Avenue, Barangay 146, Pasay City.,Ayon kay Doria, lumikha ng bogus Facebook page ang mga suspek upang palabasin ito na konektado sa isang lehitimong employment agency upang makapambiktima ng mga naghahanap ng trabaho.,Matapos ang paglikha ng pekeng pahina sa Facebook, ibinahagi ng mga suspek ang pahina sa lahat ng iba pang mga chat ng grupo na nag-aalok ng mga pagkakataon sa trabaho.,“The modus of these scammers is to make the unsuspecting victims believe that there is indeed a job opportunity waiting for successful applicants through the creation of a fake Facebook Page imitating the accounts of a legitimate hiring agency,”ani Doria.,Sinabi ni P/Major Franklin Lacana, team leader ng Southern District Anti-Cybercrime Team (SDACT), ang mga aplikante ay pinagreport sa kanilang tanggapan sa Taft Avenue para sa interview.,Kahina-hinala umano ang naging pagbabawal sa mga aplikante na makipag-usap sa kanilang kapwa aplikante o gumamit ng cellphones. Pinagbayad din sila ng P300 para sa umano’y processing fee at P1,300 para sa medical fees.","August 25, 2022  12:00am",https://www.philstar.com/pilipino-star-ngayon/metro/2022/08/25/2204919/7-job-scammer-sa-facebook-timbog
"BI ihihiwalay sa DOJ, aprub","MANILA, Philippines — Bukas si Department of Justice Secretary Jesus Crispin ­“Boying” Remulla sa panukala na ihiwalay na sa kanilang hurisdiksyon ang Bureau of Immigration (BI).,Sinabi ni Remulla na sa ibang bansa ang Immigration ay isang departamento at kasama sa highest paid na tauhan ng pamahalaan ang mga opisyal nito.,Sa Pilipinas umano ay mababa ang salary grade sa mga opisyal ng BI kaya’t dapat ding mai-modernize na at i-upgrade ito upang makatugon sa international standards pagdating sa immigration.,Gayunman, aminado ang kalihim na may balakid sa paghihiwalay ng BI sa DOJ dahil sa magkaugnay na ang immigration at mga batas ng bansa.?­Idinagdag ni Remulla na ang kasalukuyang immigration law ay maituturing nang “very obsolete” dahil bina­langkas ito noon pang 1939.,Iginiit pa ng kalihim na panahon na upang palakasin pa ang Immig­ration Department dahil ito ang ‘point of entry’ ng lahat ng kriminal kasabay ng panawagan sa BI na paigtingin ang operasyon laban sa mga sangkot sa exploitation ng mga bata.","August 25, 2022  12:00am",https://www.philstar.com/pilipino-star-ngayon/metro/2022/08/25/2204904/bi-ihihiwalay-sa-doj-aprub
"Random drug test sa PNP Anti-Cybercrime Group, umarangkada","MANILA, Philippines — Sumailalim sa random drug test ang nasa 24 na tauhan ng Philippine National Police (PNP) Anti-Cybercrime Group kahapon ng umaga.,Layon ng random drug test na matiyak na walang tauhan ng ACG ang gumagamit ng ipinagbabawal gamot.,Regular din itong ginagawa sa lahat ng mga division ng PNP upang masiguro na ang mga pulis ang nagpapatupad ng batas at hindi lumalabag sa batas lalo na sa isyu ng droga,Ayon kay Lt. Michelle Sabino, chief PIO ng Anti-Cybercrime Group, makukuha ang resulta sa loob ng 24 oras. Umaasa silang lahat ay magne­negatibo sa nasabing drug test.,Sakaling may magpositibo, may kahaharapin itong parusa at posibleng kasong admi­nistratibo.,Hindi kukunsintihin ng PNP ang tiwaling gawain ng mga pulis.","August 26, 2022  12:00am",https://www.philstar.com/pilipino-star-ngayon/metro/2022/08/26/2205205/random-drug-test-sa-pnp-anti-cybercrime-group-umarangkada
"PNR, nagsuspinde ng biyahe dahil sa mga pagbaha sa NCR","MANILA, Philippines — Napilitan ang pamunuan ng Philippine National Railways (PNR) na pansamantalang magkansela ng operasyon sa Metro Manila kahapon bunsod ng mga pagbaha dulot ng bagyong Florita.,Sa kanilang Facebook post, sinabi ng PNR na pansamantala nilang sinuspinde ang panghapong biyahe ng kanilang mga tren.,Kabilang dito ang sa Metro North o biyaheng Tutuban - Governor Pascual - Bicutan at Metro South o biyaheng Tutuban - Alabang - Tutuban.,“PAUNAWA! May temporary suspension ang mga PNR trains ngayong hapon ng Agosto 23, 2022, dahil sa pagbaha,” anang PNR.,Nauna rito, nakaranas ng mga pag-ulan at pagbaha ang Metro Manila dahil sa bagyong Florita.","August 24, 2022  12:00am",https://www.philstar.com/pilipino-star-ngayon/metro/2022/08/24/2204693/pnr-nagsuspinde-ng-biyahe-dahil-sa-mga-pagbaha-sa-ncr
Kelot utas sa ex ng nobya,"MANILA, Philippines — Utas ang isang 22-anyos na lalaki nang pagsasaksakin sa iba’t-ibang bahagi ng katawan ng dating kinakasama ng kaniyang nobya nang abutang magkatabi sa kama sa Gagalangin, Tondo, Maynila, ka­makalawa.,Kinilala ang nasawi na si Jean Syrus Buenafe, residente ng Bo. Obrero, Tondo, Maynila na nagtamo ng ilang saksak sa katawan.,Arestado naman ang suspek na kinilalang si Eyrie Elgie Jacobe, 25, ng R. Cruz St., Gagalangin, Tondo.,Sa inisyal na ulat ni Patrolman Christian Joseph Pineda ng Homicide Section ng Manila Police District, dakong alas-10:30 ng umaga nang maganap ang krimen sa bahay ng nobya ng biktima na si Trishia Unamayor, 22, sa P. Fronda St., Gagalangin, Tondo.,Sinabi ng suspek sa panayam ng media na nagawa niya ang krimen dahil inabutan niya ang kaniyang live-in partner at biktima na magkatabi sa kama sa loob ng kwarto.,Nakakuha umano siya ng patalim sa nasabing bahay at nagpambuno sila ng biktima hanggang sa masaksak niya ito.,Samantala, ayon naman sa mga kaanak ng biktima sa pahayag sa telebisyon, posibleng plano ng suspek ang naganap na krimen dahil nang duma­ting umano ito sa bahay ng biktima ay may dala nang dalawang patalim. Hindi rin umano totoo na nagkakalabuan pa lamang ang suspek at si Trishia dahil matagal na umanong may relasyon ang biktima at si Trishia.","August 26, 2022  12:00am",https://www.philstar.com/pilipino-star-ngayon/metro/2022/08/26/2205203/kelot-utas-sa-ex-ng-nobya
"643 biktima ni Florita, kinakanlong ng Quezon City LGU sa evacuation centers","MANILA, Philippines — Patuloy na kinakanlong ng Quezon City government ang may 643 indibidwal o may 211 pamilya mula sa Barangay Bagong Silangan na nabiktima ng matin­ding pagbaha dulot ng pag-uulan dala ng bagyong Florita.,Sa ulat ng QC Disaster Risk Reduction and Management Office, ang naturang mga pamilya ay nailikas sa iba’t ibang evacuation centers habang lubog pa sa baha ang tirahan ng mga ito.,May 23 pamilya o 86 katao ang nailikas sa Isolation buiding sa Brgy. Bagong Silangan, 142 pamilya o 352 indibidwal ang nailikas sa Bagong Silangan Elementary School,  22 pamilya o 101 katao sa Sulyap ng Pag-Asa Multi-Purpose Hall, 14 pamilya o 74 indibidwal naman sa Bona Subd. Multi-Purpose Hall at 9 pamilya o 30 katao ang nailikas sa Bagong Silangan High School.,Naghihintay na lamang na humupa ang baha sa kanilang mga tahanan para makabalik sa kani-kanilang mga bahay.,May mga hot meals na naipagkakaloob ang lokal na pamahalaan sa mga evacuees habang nananatili sa mga evacuation center.,Noong kasagsagan ang pananalasa ni Florita na nagdulot ng mga pag-ulan sa QC, bukod sa Barangay bagong Silangan ay may 139 pamilya o 566 katao pa ang nailikas sa mga evacuation centers mula sa Brgy. Roxas, Brgy. Sta Lucia pero ang mga ito ay nakabalik na ng kanilang tahanan kahapon ng umaga.,Tanging ang mga binaha sa Brgy. Bagong Silangan ang nananatiling nasa evacuation centers at naghihintay na lamang humupa ang  baha sa kanilang lugar para makauwi na rin.","August 25, 2022  12:00am",https://www.philstar.com/pilipino-star-ngayon/metro/2022/08/25/2204914/643-biktima-ni-florita-kinakanlong-ng-quezon-city-lgu-sa-evacuation-centers
